Aishe Code,Name,State,District,Year Of Establishment,Location,Standalone Type,Manegement
S-3556,MOTHER KRISHNA BAI SCHOOL OF NURSING HYDERABAD,Telangana,Hyderabad,2011,Rural,Nursing,Private Un-Aided
S-18167,Mother Mary School of Nursing,Karnataka,Bidar,2012,Urban,Nursing,Private Un-Aided
S-19937,MOTHER NOORUNNISSA SCHOOL OF NURSING,Karnataka,Kolar,2006,Rural,Nursing,Private Un-Aided
S-21115,"MOTHER SCHOOL OF NURSING, BHIMAVARAM",Andhra Pradesh,West Godavari,2018,Urban,Nursing,Private Un-Aided
S-20867,MOTHER SCHOOL OF NURSING DHARMASAGARAM VILLAGE NARSIPATNAM MANDAL,Andhra Pradesh,Visakhapatnam,2018,Rural,Nursing,Private Un-Aided
S-20331,MOTHERS INSTITUTE OF NURSING ACADEMY JALESWAR BALASORE,Odisha,Balasore,2021,Rural,Nursing,Private Un-Aided
S-22290,MOTHERS INTERNATIONAL INSTITUTE OF NURSING,Jharkhand,Ranchi,-,Rural,Nursing,Private Un-Aided
S-15432,Mothers Nursing School,Odisha,Khordha,2011,Urban,Nursing,Private Un-Aided
S-19424,MOTHER TERESA ANM TRAINING SCHOOL BANO,Jharkhand,Simdega,2010,Rural,Nursing,Private Un-Aided
S-21450,MOTHER TERESA COLLEGE OF NURSING,Jharkhand,Simdega,-,Rural,Nursing,Private Un-Aided
S-25004,MOTHER TERESA COLLEGE OF NURSING,Maharashtra,Palghar,-,Urban,Nursing,Private Un-Aided
S-17132,MOTHER TERESA COLLEGE OF NURSING WASHIM,Maharashtra,Washim,2011,Urban,Nursing,Private Un-Aided
S-15431,Mother Teresa Health Worker (Female) Training Centre,Odisha,Jajpur,2005,Rural,Nursing,Private Un-Aided
S-26310,MOTHER TERESA INSTITUTE OF PARAMEDICAL SCIENCES,Uttar Pradesh,Rampur,2013,Rural,Nursing,Private Un-Aided
S-26011,MOTHER TERESA MEMORIAL COLLEGE OF NURSING,Maharashtra,Kolhapur,2024,Urban,Nursing,Private Un-Aided
S-17956,MOTHER TERESA MEMORIAL NURSING ACADEMY BALLARPUR,Maharashtra,Chandrapur,1995,Rural,Nursing,Private Un-Aided
S-17920,"MOTHER TERESA NURSING INSTITUTE, KANDHAR",Maharashtra,Nanded,2011,Urban,Nursing,Private Un-Aided
S-17510,"MOTHER TERESA NURSING INSTITUTE, NAGPUR",Maharashtra,Nagpur,2007,Urban,Nursing,Private Un-Aided
S-14830,"MOTHER TERESA NURSING SCHOOL, AARAH",Bihar,Bhojpur,-,Rural,Nursing,-
S-17978,"MOTHER TERESA NURSING SCHOOL,HINGOLI",Maharashtra,Nanded,2011,Urban,Nursing,State Government
S-24318,"MOTHER TERESA NURSING SCHOOL, HINGOLI",Maharashtra,Hingoli,-,Urban,Nursing,Private Un-Aided
S-5444,MOTHER TERESA NURSING SCHOOL & HOSPITAL SAHARANPUR,Uttar Pradesh,Saharanpur,2010,Urban,Nursing,Private Un-Aided
S-14831,"MOTHER TERESA NURSING SCHOOL, KATIHAR",Bihar,Katihar,2011,Urban,Nursing,Local Body
S-25198,MOTHER TERESA NURSING SCHOOL MUKHED,Maharashtra,Nanded,-,Rural,Nursing,Private Un-Aided
S-23467,MOTHER TERESA NURSING SCHOOL SELU DIST PARBHANI,Maharashtra,Parbhani,2023,Rural,Nursing,Private Un-Aided
S-20794,MOTHER TERESA RANM NURSING INSTITUTE UDGIR,Maharashtra,Latur,2010,Urban,Nursing,Private Un-Aided
S-15430,Mother Teresa School of Nursing,Odisha,Angul,2013,Urban,Nursing,Private Un-Aided
S-14819,"MOTHER TERESA SCHOOL OF NURSING ANM SCHOOL, RANCHI ROAD, BIHARSARIF, NALANDA",Bihar,Nalanda,-,-,Nursing,-
S-17835,Mother Teresa School Of Nursing Buldana,Maharashtra,Buldhana,2007,Urban,Nursing,Private Un-Aided
S-21706,"MOTHER TERESA SCHOOL OF NURSING, HOSHANGABAD, BLOCK KESLA",Madhya Pradesh,Narmadapuram,-,Rural,Nursing,Private Un-Aided
S-26975,"MOTHER TERESA SCHOOL OF NURSING, RAJURI VESS, BEED",Maharashtra,Beed,2023,Rural,Nursing,Private Un-Aided
S-16010,MOTHER TERRASA NURSING INSTITUTE,Gujarat,Mahesana,2014,Rural,Nursing,Private Un-Aided
S-16009,MOTHER TERRASA SCHOOL OF NURSING,Gujarat,Mahesana,2009,Rural,Nursing,Private Un-Aided
S-4154,MOTHER THERESA NURSING SCHOOL GADAG,Karnataka,Gadag,2004,Urban,Nursing,Private Un-Aided
S-4155,MOTHER THERESA SCHOOL OF NURSING BANGALORE RURAL,Karnataka,Bengaluru Rural,2004,Rural,Nursing,Private Un-Aided
S-14125,"MOTHER THERESA SCHOOL OF NURSING, BIDAR",Karnataka,Bidar,2005,Urban,Nursing,Private Un-Aided
S-3557,MOTHER THERESA SCHOOL OF NURSING EAST GODAVARI,Andhra Pradesh,East Godavari,2003,Urban,Nursing,Private Un-Aided
S-13116,"MOTHER THERESA SCHOOL OF NURSING, KADAPA, CUDDAPAH",Andhra Pradesh,Y.S.R. Kadapa,2012,Urban,Nursing,Private Un-Aided
S-3558,MOTHER THERESA SCHOOL OF NURSING KRISHNA,Andhra Pradesh,Krishna,1998,Rural,Nursing,Private Un-Aided
S-13267,"MOTHER THERESA SCHOOL OF NURSING, KUSHAIGUDA, HYDERABAD",Telangana,Ranga Reddy,2004,Urban,Nursing,Private Un-Aided
S-12941,"MOTHER THERESA SCHOOL OF NURSING, VIZAG, VISAKHAPATNAM",Andhra Pradesh,Visakhapatnam,2015,Urban,Nursing,Private Un-Aided
S-4157,MOTHER THERESA'S SCHOOL OF NURSING CHITRADURGA,Karnataka,Chitradurga,1992,Urban,Nursing,Private Un-Aided
S-3561,MOTHER VANNINI HOSPITAL WEST GODAWARI,Andhra Pradesh,West Godavari,1998,Rural,Nursing,Private Un-Aided
S-20565,MOUNTAIN VALLEY SCHOOL OF NURSING,Karnataka,Bengaluru Urban,2015,Urban,Nursing,Private Un-Aided
S-19933,MOUNT SHEPHERD SCHOOL OF NURSING,Karnataka,Bengaluru Urban,2003,Urban,Nursing,Private Un-Aided
S-20630,MPHW FEMALE TRAINING SCHOOL CIVIL HOSPITAL MOGA,Punjab,Moga,1978,Urban,Nursing,State Government
S-15722,MPHW (F) TRAINING SCHOOL CIVIL HOSPITAL,Punjab,Hoshiarpur,1960,Urban,Nursing,State Government
S-22549,"MPHW F TRAINING SCHOOL ,CIVIL HOSPITAL, GURDASPUR",Punjab,Gurdaspur,-,Urban,Nursing,State Government
S-20230,"M.P.H.W. (F) Training School, Nangal",Punjab,Rupnagar,1960,Urban,Nursing,State Government
S-13050,"M P R MEMORIAL SCHOOL OF NURSING, NADIKUDI, GUNTUR",Andhra Pradesh,Guntur,2004,Urban,Nursing,Private Un-Aided
S-4683,M P S COLLEGE OF NURSING & RESEARCH GWALIOR,Madhya Pradesh,Gwalior,2010,Urban,Nursing,Private Un-Aided
S-17780,MPW (F) TRAINING INSTITUTE,Tripura,Unakoti,2007,Urban,Nursing,State Government
S-5531,M R BANGUR HOSPITAL KOLKATTA,West Bengal,South 24 Parganas,1994,Urban,Nursing,State Government
S-21603,M R BHARTI SCHOOL OF NURSING,Delhi,West,-,Rural,Nursing,Private Un-Aided
S-17832,Mrs. Kumudben Madanbhai Sura Nursing School,Maharashtra,Pune,2002,Urban,Nursing,Private Un-Aided
S-13118,"MSR SCHOOL OF NURSING, KADAPA, CUDDAPAH",Andhra Pradesh,Y.S.R. Kadapa,2012,Urban,Nursing,State Government
S-12932,"M S R SCHOOL OF NURSING, MAHARANI PET, VISAKHAPATNAM",Andhra Pradesh,Visakhapatnam,2003,Urban,Nursing,Private Un-Aided
S-19764,M S SCHOOL OF NURSING,Karnataka,Bengaluru Urban,-,Urban,Nursing,Private Un-Aided
S-19577,MUBARAKH PARAMEDICAL TRAINING INSTITUTE HYDERPORA,Jammu and Kashmir,Srinagar,1998,Rural,Nursing,Private Un-Aided
S-20042,MUKTADHARA NURSING INSTITUTION,West Bengal,Bankura,2021,Rural,Nursing,Private Un-Aided
S-25617,MUKTAI COLLEGE OF NURSING,Maharashtra,Kolhapur,-,Rural,Nursing,Private Un-Aided
S-21618,MUKTAI COLLEGE OF NURSING EDUCATION BHANDISHEGAON PANDHARPUR,Maharashtra,Solapur,-,Rural,Nursing,State Government
S-22401,MUKTAI NURSING COLLEGE,Maharashtra,Nanded,-,Urban,Nursing,Private Un-Aided
S-25324,"MUKTAI NURSING COLLEGE, GIRIM",Maharashtra,Pune,-,Rural,Nursing,Private Un-Aided
S-17009,"MUKTAI NURSING SCHOOL, RATHOD CORNER DHANEGAON NANDED",Maharashtra,Nanded,2011,Urban,Nursing,Private Un-Aided
S-15433,Mukti ANM Training Centre,Odisha,Puri,2004,Rural,Nursing,Private Un-Aided
S-27016,"MUKTI COLLEGE OF NURSING, POTERU",Odisha,Malkangiri,2025,Rural,Nursing,Private Un-Aided
S-25001,"MUKTI SCHOOL OF NURSING, CUTTACK",Odisha,Cuttack,-,Urban,Nursing,Private Un-Aided
S-24465,"MUKTI SCHOOL OF NURSING, MALKANGIRI",Odisha,Malkangiri,-,Rural,Nursing,Private Un-Aided
S-20881,MUKUNDRAV PHATAK NURSING COLLEGE DEVGAD,Maharashtra,Sindhudurg,2021,Rural,Nursing,Private Un-Aided
S-20874,MULA PRAVARA NURSING SCHOOL,Maharashtra,Ahilyanagar,2019,Rural,Nursing,Private Un-Aided
S-17031,Mungasaji Maharaj Nursing School Yavatmal,Maharashtra,Yavatmal,2008,Urban,Nursing,Private Un-Aided
S-17967,Mungsaji Maharaj Nursing School Darwha Dist Yavatmal,Maharashtra,Yavatmal,2008,Urban,Nursing,Private Un-Aided
S-3782,MUNISEVA ASHRAM SCHOOL OF NURSING VADODARA,Gujarat,Vadodara,2003,Rural,Nursing,Private Un-Aided
S-13017,"MURALI KRISHNA SCHOOL OF NURSING, VEDAYAPALEM, NELLORE",Andhra Pradesh,Sri Potti Sriramulu Nellore,1987,Rural,Nursing,Private Un-Aided
S-4785,MURE MEMORIAL HOSPITAL SCHOOL OF NURSING NAGPUR,Maharashtra,Nagpur,1934,Urban,Nursing,Private Un-Aided
S-26142,MURLI SINGH YADAV MEMORIAL NURSING INSTITUTE UDAIRAMSAR,Rajasthan,Bikaner,2021,Rural,Nursing,Private Un-Aided
S-4122,M V J SCHOOL OF NURSING BANGALORE URBAN,Karnataka,Bengaluru Urban,1993,Rural,Nursing,Private Un-Aided
S-19934,M V M SCHOOL OF NURSING,Karnataka,Bengaluru Urban,2000,Urban,Nursing,Private Un-Aided
S-13990,"M.Y. PATEL SCHOOL OF NURSING, ATKOT",Gujarat,Rajkot,2010,Rural,Nursing,Private Un-Aided
S-26774,Mythri College of Nursing,Karnataka,Shivamogga,2025,Urban,Nursing,Private Un-Aided
S-13173,"MYTHRI SCHOOL OF NURSING, BHEMARAM, WARANGAL",Telangana,Warangal,2007,Urban,Nursing,Private Un-Aided
S-3563,MYTHRI SCHOOL OF NURSING HYDERABAD-,Telangana,Hyderabad,2003,Urban,Nursing,Private Un-Aided
S-4159,MYTHRI SCHOOL OF NURSING SHIMOGA,Karnataka,Shivamogga,2004,Urban,Nursing,Private Un-Aided
S-26860,NABADWIP SCHOOL OF NURSING ,West Bengal,Nadia,2021,Urban,Nursing,Private Un-Aided
S-19889,NABARANGPUR ANM TRAINING CENTRE,Odisha,Nabarangpur,2020,Rural,Nursing,Private Aided (Government Aided)
S-19756,NAGANAGOWDA DIDIGI SCHOOL OF NURSING,Karnataka,Raichur,-,Urban,Nursing,Private Un-Aided
S-3566,NAGARJUNA SCHOOL OF NURSING KRISHNA,Andhra Pradesh,Krishna,2004,Rural,Nursing,Private Un-Aided
S-4162,NAGESH SCHOOL OF NURSING HASSAN,Karnataka,Hassan,2004,Rural,Nursing,Private Un-Aided
S-17726,NAGFANI INSTITUTE OF NURSING,Rajasthan,Udaipur,2007,Rural,Nursing,Private Un-Aided
S-14808,"NAINA NURSING INSTITUTE, MUZAFFARPUR",Bihar,Muzaffarpur,2010,Rural,Nursing,Private Un-Aided
S-14818,"NALANDA ANM NURSING, GARDHPUR, NALANDA",Bihar,Nalanda,2010,Rural,Nursing,Private Un-Aided
S-24995,NALANDA FOUNDATION BEED SANCHALIT MATA RAMAI COLLEGE OF NURSING,Maharashtra,Beed,-,Urban,Nursing,Private Un-Aided
S-20837,NALANDA NURSING INSTITUTE,Gujarat,Rajkot,2021,Rural,Nursing,Private Un-Aided
S-21438,NALANDA NURSING SCHOOL,Jharkhand,Ramgarh,-,Rural,Nursing,Private Un-Aided
S-22513,NALBARI NURSING AND PARAMEDICAL INSTITUTE,Assam,Nalbari,-,Rural,Nursing,Private Un-Aided
S-20506,NAMDAPHA NURSING INSTITUTE,Arunachal Pradesh,Changlang,2019,Rural,Nursing,Private Un-Aided
S-15444,Namitadevi School of Nursing,Odisha,Puri,2010,Rural,Nursing,Private Aided (Government Aided)
S-25625,NANASO NARHAR NAGRAJ PATIL NURSING COLLEGE,Maharashtra,Jalgaon,-,Rural,Nursing,Private Un-Aided
S-18015,"NANDA AAI BAHU UDDESHIY MAHILA MANDALS, NURSING TRAINING CENTER",Maharashtra,Dhule,2009,Urban,Nursing,Private Un-Aided
S-4163,NANDA GOKULA SCHOOL OF NURSING KOLAR,Karnataka,Kolar,2000,Urban,Nursing,Private Un-Aided
S-3868,NANDA HOSPITAL UNA,Himachal Pradesh,Una,2009,Rural,Nursing,Private Un-Aided
S-17795,"Nandatai lohave school of Nursing, Wardha",Maharashtra,Wardha,2011,Rural,Nursing,Private Aided (Government Aided)
S-19812,NANDIGRAM NURSING COLLEGE NANDED DIST NANDED,Maharashtra,Nanded,2020,Urban,Nursing,Private Un-Aided
S-4037,"NANDI  INSTITUTE OF NURSING SCIENCES,BAGALKOT",Karnataka,Bagalkote,2008,Urban,Nursing,Private Un-Aided
S-25549,NANDINI INSTITUTE OF NURSING    ,Jharkhand,Saraikela Kharsawan,-,Rural,Nursing,Private Un-Aided
S-26457,NANDINI SCHOOL OF NURSING,Karnataka,Chitradurga,2004,Urban,Nursing,Private Un-Aided
S-4165,NANDINI SCHOOL OF NURSING RAICHUR,Karnataka,Raichur,2000,Urban,Nursing,Private Aided (Government Aided)
S-25317,NANDINI SHIKSHAN SANSTHA PARBHANI SANCHALIT DECCAN NURSING COLLEGE PARBHANI,Maharashtra,Parbhani,-,Urban,Nursing,Private Un-Aided
S-4166,NANJAPPA TRUST HOSPITAL SHIMOGA,Karnataka,Shivamogga,1994,Urban,Nursing,Private Un-Aided
S-4167,NARAYANA HRUDAYALA SCHOOL OF NURSING BANGALORE RURAL,Karnataka,Bengaluru Urban,-,Urban,Nursing,Private Un-Aided
S-20171,NARAYANAN COLLEGE,Madhya Pradesh,Gwalior,2020,Rural,Nursing,Local Body
S-3567,NARAYANA SCHOOL OF NURSING NELLORE,Andhra Pradesh,Sri Potti Sriramulu Nellore,2003,Rural,Nursing,Private Un-Aided
S-3568,NARAYANA SCHOOL OF NURSING SRIKAKULAM,Andhra Pradesh,Srikakulam,2004,Urban,Nursing,Private Un-Aided
S-4871,NARAYANI SCHOOL OF NURSING JAGATSINGHPUR,Odisha,Jagatsinghapur,2008,Rural,Nursing,Private Un-Aided
S-26393,NARAYAN MEMORIAL INSTITUTE OF MEDICAL SCIENCE,Odisha,Kendrapara,2025,Rural,Nursing,Private Un-Aided
S-13796,"NARAYAN NURSING COLLEGE, SASARAM",Bihar,Rohtas,2012,Rural,Nursing,Private Aided (Government Aided)
S-17599,narmada institute of nursing medical science,Madhya Pradesh,Khargone (West Nimar),2014,Rural,Nursing,State Government
S-12982,"NARSAPUR CHRISTIAN HOSPITAL, NARSAPUR, WEST GODAVARI",Andhra Pradesh,West Godavari,2000,Rural,Nursing,Private Un-Aided
S-4788,NASIK MEDICO TRAINING PVT LTD NASIK,Maharashtra,Nashik,2004,Urban,Nursing,Private Un-Aided
S-4990,NATIONAL COLLEGE OF GENERAL NURSING & MIDWIFERY BARNALA,Punjab,Barnala,1994,Urban,Nursing,Private Un-Aided
S-20347,NATIONAL EDUCATION INSTITUTE OF NURSING MAGLANA ROAD MAKRANA,Rajasthan,Nagaur,2010,Rural,Nursing,Private Aided (Government Aided)
S-15825,"NATIONAL HEALTH LAW RESEARCH INSTITUTES, CHINGUAAI INSTITUTE OF NURSING EDUCATION,KAVATHE MAHANKAL,",Maharashtra,Sangli,2009,Rural,Nursing,Private Un-Aided
S-4542,NATIONAL HOSPITAL SCHOOL OF NURSING KOZHIKODE,Kerala,Kozhikode,1994,Urban,Nursing,Private Un-Aided
S-4872,NATIONAL INSTITUTE OF MEDICAL & MANAGEMENT STUDIES KHURDA,Odisha,Khordha,2005,Urban,Nursing,Private Un-Aided
S-22449,NATIONAL INSTITUTE OF MEDICAL SCIENCE,Odisha,Mayurbhanj,-,Rural,Nursing,Private Un-Aided
S-22438,NATIONAL INSTITUTE OF NURSING,Assam,Darrang,-,Urban,Nursing,Private Un-Aided
S-20030,NATIONAL INSTITUTE OF NURSING AND PARAMEDICAL SCIENCE,Bihar,Nalanda,2013,Rural,Nursing,Private Aided (Government Aided)
S-21065,"NATIONAL MPHW MALE TRAINING SCHOOL, BEHBALPUR, HISAR",Haryana,Hisar,2012,Rural,Nursing,Private Un-Aided
S-21011,NATIONAL NURSING INSTITUTE,Haryana,Hisar,2005,Urban,Nursing,Private Un-Aided
S-4544,NATIONAL SCHOOL OF NURISNG THIRUVANANTHAPURAM,Kerala,Thiruvananthapuram,2001,Urban,Nursing,Private Un-Aided
S-19225,NATIONAL SCHOOL OF NURSING,Karnataka,Kolar,2019,Rural,Nursing,Private Un-Aided
S-13193,"NATIONAL SCHOOL OF NURSING, ADONI, KURNOOL DISTRICT",Andhra Pradesh,Kurnool,2012,Rural,Nursing,Private Un-Aided
S-18106,"NATIONAL SCHOOL OF NURSING, AKOLA",Maharashtra,Akola,2005,Urban,Nursing,Private Un-Aided
S-4168,NATIONAL SCHOOL OF NURSING BANGALORE,Karnataka,Bengaluru Urban,2003,Urban,Nursing,Private Un-Aided
S-3831,NATIONAL SCHOOL OF NURSING FATEHABAD,Haryana,Fatehabad,2000,Rural,Nursing,Private Un-Aided
S-21119,"NATIONAL SCHOOL OF NURSING, KAKINADA",Andhra Pradesh,East Godavari,2018,Rural,Nursing,Private Un-Aided
S-3570,NATIONAL SCHOOL OF NURSING PRAKASAM,Andhra Pradesh,Prakasam,1989,Urban,Nursing,Private Un-Aided
S-4692,NAVAL KISHORE SHIVHARE NURSING SCHOOL BHIND,Madhya Pradesh,Bhind,2006,Rural,Nursing,Private Aided (Government Aided)
S-4170,NAVANEETHAM SCHOOL OF NURSING BANGALORE,Karnataka,Bengaluru Urban,1972,Urban,Nursing,Private Un-Aided
S-18267,Naveen Institute of Nursing,Haryana,Mahendragarh,2018,Rural,Nursing,Private Un-Aided
S-17814,NAVIN NURSING SCHOOL OSMANABAD,Maharashtra,Dharashiv,2011,Urban,Nursing,Private Aided (Government Aided)
S-18112,Navjeevan Institute Of Nursing Sciences Ahmedpur Dist. Latur,Maharashtra,Latur,2011,Urban,Nursing,Private Un-Aided
S-15487,Navjeevan nursing school chamorshi dist. gadchiroli,Maharashtra,Gadchiroli,2005,Rural,Nursing,Private Un-Aided
S-21421,NAVJEEVAN NURSING SCHOOL DIST CHANDRAPUR,Maharashtra,Chandrapur,-,Urban,Nursing,Private Aided (Government Aided)
S-18113,Navjeevan School Of Nursing Ahmedpur Dist. Latur,Maharashtra,Latur,2009,Urban,Nursing,Private Un-Aided
S-5533,NAVJEEVAN SCHOOL OF NURSING DARJEELING,West Bengal,Darjeeling,2003,Rural,Nursing,Private Un-Aided
S-16205,"Navjeevan School of Nursing, Shahapur",Maharashtra,Thane,2010,Rural,Nursing,Private Un-Aided
S-5127,NAVJEEVAN TRAINING INSTITUTE SIKAR,Rajasthan,Sikar,-,Rural,Nursing,Private Un-Aided
S-20584,NAVJIVAN INSTITUTE OF NURSING,Gujarat,Surat,2021,Rural,Nursing,Private Un-Aided
S-25237,"NAVNEET COLLEGE OF NURSING , CHINORA , WARORA",Maharashtra,Chandrapur,-,Rural,Nursing,Private Un-Aided
S-25255,"NAVNIRMAN INSTITUTE OF NURSING EDUCATIOIN, LOVALE, SANGMESHWAR",Maharashtra,Ratnagiri,-,Rural,Nursing,Private Un-Aided
S-20102,NAVRANG PRABHUNATH INSTITUTEOF NURSING AND HOSPITAL,Bihar,Siwan,2020,Rural,Nursing,Private Aided (Government Aided)
S-17080,NAVYUVA NURSING SCHOOL,Maharashtra,Bhandara,2011,Urban,Nursing,Private Un-Aided
S-20605,NAWADA COLLEGE OF NURSING,Bihar,Nawada,2019,Rural,Nursing,Private Un-Aided
S-5292,NAYAGI INSTITUTE OF NURSING VELLORE,Tamil Nadu,Vellore,2009,Rural,Nursing,Private Aided (Government Aided)
S-16256,"Nazarene Nursing Training College, Reynolds Memorial Hospital, Washim",Maharashtra,Washim,2010,Urban,Nursing,Private Un-Aided
S-5447,NAZARETH HOSPITAL SCHOOL OF NURSING ALLAHABAD,Uttar Pradesh,Prayagraj,1990,Urban,Nursing,Private Un-Aided
S-20677,NAZIRUL HASAN INSTITUTE OF HIGHER EDUCATION SONIHAR KHAGARIA,Bihar,Khagaria,2019,Rural,Nursing,Private Un-Aided
S-20022,NAZMA INSTITUTE OF NURSING EDUCATION PIPRA KHAS MIRGANJ,Bihar,Gopalganj,2018,Rural,Nursing,Private Un-Aided
S-26858,NBS INSTITUTE OF NURSING ,Maharashtra,Latur,2024,Urban,Nursing,Private Un-Aided
S-4160,N C PATEL SCHOOL OF NURSING BANGALORE,Karnataka,Bengaluru Urban,2003,Urban,Nursing,Private Un-Aided
S-20589,N D NAKUM INSTITUTE OF NURSING,Gujarat,Bhavnagar,2020,Rural,Nursing,Private Un-Aided
S-4873,NEELACHAL INSTITUTE OF NURSING SCHOOL,Odisha,Khordha,2015,Urban,Nursing,Private Un-Aided
S-25985,NEELAMBIKA SCHOOL OF NURSING,Karnataka,Bidar,2024,Urban,Nursing,Private Un-Aided
S-5448,NEELAVAYNI KRISHNA SCHOOL OF NURSING RAMPUR,Uttar Pradesh,Rampur,2008,Rural,Nursing,Private Aided (Government Aided)
S-20544,NEELGANGA INSTITUTE OF NURSING SCIENCE,Karnataka,Bidar,2018,Rural,Nursing,Private Un-Aided
S-18618,NEELGANGA SCHOOL OF NURSING,Karnataka,Bidar,2019,Urban,Nursing,Private Un-Aided
S-21725,NEELKANTH COLLEGE OF EDUCATION,Uttar Pradesh,Jaunpur,-,Rural,Nursing,Private Un-Aided
S-20505,NEF INSTITUTE OF NURSING,Assam,Kamrup Metro,2021,Urban,Nursing,Private Un-Aided
S-23788,NEHA SCHOOL OF NURSING GNM PARBHANI,Maharashtra,Parbhani,2024,Urban,Nursing,Private Un-Aided
S-20636,NEKI RAM NURSING COLLEGE,Haryana,Rohtak,2010,Rural,Nursing,Private Un-Aided
S-13019,"NELLORE SCHOOL OF NURSING, VEDAYAPALEM, NELLORE",Andhra Pradesh,Sri Potti Sriramulu Nellore,1989,Urban,Nursing,Private Aided (Government Aided)
S-13868,"NEMCARE SCHOOL OF NURSING, BHANGAGARH, GUWAHATI",Assam,Kamrup,2010,Rural,Nursing,Private Aided (Government Aided)
S-19427,NEOMEDICS COLLEGE OF NURSING,Jharkhand,Bokaro,2020,Rural,Nursing,Private Un-Aided
S-12072,NEOTIA ACADEMY NURSING TRAINING INSTITUTE,West Bengal,Kolkata,2011,Urban,Nursing,Private Un-Aided
S-22508,"N E SCHOOL OF NURSING, KALGACHIA",Assam,Barpeta,-,Rural,Nursing,Private Un-Aided
S-15446,NETAJI SCHOOL OF NURSING,Odisha,Khordha,2006,Urban,Nursing,Private Aided (Government Aided)
S-19836,NETAJI SCHOOL OF NURSING KENDRAPARA,Odisha,Kendrapara,2020,Rural,Nursing,Private Un-Aided
S-4172,NETHAJI SCHOOL OF NURSING DAKSHINA KANNADA,Karnataka,Dakshina Kannada,2003,Urban,Nursing,Private Un-Aided
S-4173,NEW CITY HOSPITAL SCHOOL OF NURSING UDUPI,Karnataka,Udupi,2009,Urban,Nursing,Private Un-Aided
S-26773,NEW ERA SCHOOL OF NURSING,Karnataka,Kolar,2025,Urban,Nursing,Private Un-Aided
S-20484,NEW ERA SCHOOL OF NURSING NATIONAL SON,Karnataka,Ballari,2007,Urban,Nursing,Private Un-Aided
S-18620,NEW INDIAN SCHOOL OF NURSING,Karnataka,Bengaluru Urban,2019,Urban,Nursing,Private Un-Aided
S-20617,NEW LIFE SCHOOL OF NURSING,Karnataka,Bengaluru Urban,-,Urban,Nursing,Private Un-Aided
S-18123,New Maharashta Institute of Nursing,Maharashtra,Wardha,2009,Urban,Nursing,State Government
S-20621,NEW MALWA INSTITUTE OF NURSING KOTKAPURA,Punjab,Faridkot,2011,Urban,Nursing,Private Un-Aided
S-21973,NEW MODERN INSTITUTE OF PARAMEDICAL AND NURSING SCIENCES KISHTWAR,Jammu and Kashmir,Kishtwar,-,Rural,Nursing,Private Un-Aided
S-18021,"New Mother Teresa A.N.M. School of Nursing, Udgir",Maharashtra,Latur,2011,Urban,Nursing,Private Un-Aided
S-24790,NEW MUZAFFARNAGAR AYURVED NURSING AND HOSPITAL,Uttar Pradesh,Muzaffarnagar,-,Urban,Nursing,Private Un-Aided
S-4174,NEW NAVODAYA INSTITUTE OF NURSING MANDYA,Karnataka,Mandya,2004,Rural,Nursing,Private Un-Aided
S-17806,"New Nursing School, Beed",Maharashtra,Beed,2009,Urban,Nursing,Private Un-Aided
S-20038,NEW PRAGATHI INSTITUTE OF NURSING,Karnataka,Bengaluru Urban,2019,Urban,Nursing,Private Un-Aided
S-17114,NEW RAJMATA JIJAU RGNM NURSING SCHOOL,Maharashtra,Nanded,2017,Urban,Nursing,Private Un-Aided
S-4175,NEW SARVODAYA SCHOOL OF NURSING BANGALORE,Karnataka,Bengaluru Urban,2003,Urban,Nursing,Private Un-Aided
S-26768,NEWSHINE INSTITUTE OF NURSING,Odisha,Jharsuguda,2025,Rural,Nursing,Private Un-Aided
S-18778,NEW SHUSHRUTI SCHOOL OF NURSING,Karnataka,Bengaluru Urban,2019,Urban,Nursing,Private Un-Aided
S-23676,NEWTON COLLEGE OF HEALTH AND SCIENCE,Odisha,Sundargarh,2024,Urban,Nursing,Private Un-Aided
S-20756,NEWTOWN INSTITUTE OF NURSING SCIENCE,West Bengal,South 24 Parganas,2021,Rural,Nursing,Private Aided (Government Aided)
S-16104,"New Vision Nursing School, Latur",Maharashtra,Latur,2010,Urban,Nursing,Private Un-Aided
S-5290,N H SCHOOL OF NURSING NAGAPATTINAM,Tamil Nadu,Nagapattinam,2002,Rural,Nursing,Private Aided (Government Aided)
S-19709,NIBEDITA INSTITUTE OF NURSING EDUCATION AND TRAINING CENTRE,Odisha,Ganjam,2020,Rural,Nursing,Private Un-Aided
S-21842,NICHITPUR INSTITUTE OF HEALTH EDUCATION AND RESEARCH CENTRE,Jharkhand,Dhanbad,-,Rural,Nursing,Private Un-Aided
S-21071,NIDAN NURSING INSTITUTE,West Bengal,Murshidabad,-,Urban,Nursing,Local Body
S-4176,NIDA SCHOOL OF NURSING BIDAR,Karnataka,Bidar,2004,Urban,Nursing,Private Un-Aided
S-16130,"NIFAD NURSING SCHOOL, NIFAD",Maharashtra,Nashik,2011,Rural,Nursing,Private Un-Aided
S-4178,NIGHTANGLE SCHOOL OF NURSING CHIKMAGALUR,Karnataka,Chikkamagaluru,2003,Urban,Nursing,Private Un-Aided
S-19901,NIGHTINGALE INSTITUTE OF NURSING MORIGAON,Assam,Marigaon,-,Urban,Nursing,Private Aided (Government Aided)
S-17691,Nightingale Nursing Institute,Manipur,Imphal East,2003,Urban,Nursing,Private Aided (Government Aided)
S-4180,NIGHTINGALE SCHOOL OF DIPLOMA IN GENERAL NURSING & BIDAR,Karnataka,Bidar,2004,Urban,Nursing,Private Un-Aided
S-19202,Nightingale School Of Nursing,Karnataka,Mysuru,2019,Rural,Nursing,Private Un-Aided
S-4181,NIGHTINGALE SCHOOL OF NURSING BANGALORE,Karnataka,Bengaluru Urban,2003,Urban,Nursing,Private Un-Aided
S-13210,"NIGHTINGALE SCHOOL OF NURSING, MEHIDIPATNAM, HYDERABAD",Telangana,Hyderabad,2000,Urban,Nursing,Private Un-Aided
S-20400,NIGHTINGALE SCHOOL OF NURSING SABBAVARAM,Andhra Pradesh,Visakhapatnam,2020,Rural,Nursing,Private Aided (Government Aided)
S-21444,NIGHTINGAL SCHOOL OF NURSING,Jharkhand,Ranchi,-,Rural,Nursing,Private Un-Aided
S-23824,NIKAM COLLEGE OF NURSING AT POST GONDUR TAL DIST DHULE,Maharashtra,Dhule,-,Rural,Nursing,Private Un-Aided
S-13232,"NIKHIL SCHOOL OF NURSING, GAUTAM NAGAR, HYDERABAD",Telangana,Ranga Reddy,2007,Rural,Nursing,Private Un-Aided
S-26874,NILACHAKRA SCHOOL AND COLLEGE OF NURSING,Odisha,Jagatsinghapur,2025,Rural,Nursing,Private Un-Aided
S-26948,NILALAXMI INSTITUTE OF HEALTH SCIENCE ,Odisha,Keonjhar,2025,Urban,Nursing,Private Un-Aided
S-22762,NILANJANA MEMORIAL NURSING ACADEMY,West Bengal,Jalpaiguri,2022,Rural,Nursing,Private Un-Aided
S-22227,NILKANTH INSTITUTE OF NURSING,Gujarat,Surendranagar,-,Urban,Nursing,Private Un-Aided
S-5534,NIL RATAN SIRCAR MEDICAL COLLEGE HOSPITAL KOLKATA,West Bengal,Kolkata,1944,Urban,Nursing,State Government
S-4539,N I M S SCHOOL OF NURSING MALAPPURAM,Kerala,Malappuram,2006,Rural,Nursing,Private Un-Aided
S-15258,NIMT HOSPITAL,Uttar Pradesh,Gautam Buddha Nagar,2008,Urban,Nursing,Private Un-Aided
S-23003,NIRMALA DEVI NURSING AND PARAMEDICAL INSTITUTE JAUNPUR,Uttar Pradesh,Jaunpur,2022,Urban,Nursing,Private Un-Aided
S-21435,NIRMALA DEVI NURSING SCHOOL,Jharkhand,Khunti,-,Urban,Nursing,Private Aided (Government Aided)
S-3784,NIRMALA GAJWANI SCHOOL OF NURSING KUTCH,Gujarat,Kachchh,2010,Urban,Nursing,Private Un-Aided
S-4545,NIRMALA HOSPITAL KOZHIKODE,Kerala,Kozhikode,1969,Urban,Nursing,Local Body
S-4546,NIRMALA MEDICAL CENTRE ERNAKULUM,Kerala,Ernakulam,2002,Urban,Nursing,Private Un-Aided
S-18404,Nirmala Nursing School,Jharkhand,Dhanbad,-,Rural,Nursing,Private Un-Aided
S-4182,NIRMALA RAMANA NURSING SCHOOL KODAGU,Karnataka,Kodagu,2005,Rural,Nursing,Private Un-Aided
S-3572,NIRMALA SCHOOL OF NURSING ANANTHAPUR,Andhra Pradesh,Ananthapuramu,1987,Rural,Nursing,Private Un-Aided
S-4183,NIRMALA SCHOOL OF NURSING BANGALORE RURAL,Karnataka,Bengaluru Urban,2003,Rural,Nursing,Private Aided (Government Aided)
S-4184,NIRMALA SCHOOL OF NURSING SHIMOGA,Karnataka,Shivamogga,2004,Urban,Nursing,Private Un-Aided
S-13308,"NIRMALA SCHOOL OF NURSING, SURYAPET, NALGONDA",Telangana,Nalgonda,2003,Urban,Nursing,Private Un-Aided
S-22235,NIRMANA SCHOOL OF NURSING,Odisha,Khordha,-,Rural,Nursing,Private Un-Aided
S-24778,NIRMITI NURSING COLLEGE,Maharashtra,Nanded,-,Urban,Nursing,Private Un-Aided
S-5128,NIROGDHAM SCHOOL OF NURSING JHALAWAR,Rajasthan,Jhalawar,2006,Urban,Nursing,Private Un-Aided
S-22451,NIRU BORA INSTITUTE OF HEALTH AND SCIENCE EDUCATION,Assam,Marigaon,-,Urban,Nursing,Private Aided (Government Aided)
S-23823,"NIRVANA INSTITUTE OF NURSING EDUCATION, SANGAVI, SHIRPUR, DHULE",Maharashtra,Dhule,-,Rural,Nursing,Private Un-Aided
S-4185,NISARGA SCHOOL OF NURSING HASSAN,Karnataka,Hassan,2003,Urban,Nursing,Private Un-Aided
S-4693,NISHAD COLLEGE OF NURSING & ALLIED SCIENCES SATNA,Madhya Pradesh,Satna,2008,Rural,Nursing,Local Body
S-4186,NITTE USHA INSTT. OF NURSING SCIENCES DAKSHINA KANNADA,Karnataka,Dakshina Kannada,1992,Rural,Nursing,Private Un-Aided
S-26949,NITYANANDA INSTITUTE OF MEDICAL SCIENCE,Odisha,Balasore,2025,Rural,Nursing,Private Un-Aided
S-17986,NITYASEVA NURSING SCHOOL ALKUTI TAL PARNER DIST AHMEDNAGAR,Maharashtra,Ahilyanagar,2011,Rural,Nursing,Private Un-Aided
