Aishe Code,Name,State,District,Year Of Establishment,Location,Standalone Type,Manegement
S-26863,AADHYA INTEGRATED INSTITUTE OF MANAGEMENT STUDIES,Kerala,Malappuram,2025,Rural,PGDM Institutes,Private Un-Aided
S-133,ABBS School of Management,Karnataka,Bengaluru Urban,2009,Urban,PGDM Institutes,Private Un-Aided
S-339,ACCMAN INSTITUTE OF MANAGEMENT,Uttar Pradesh,Gautam Buddha Nagar,-,Urban,PGDM Institutes,-
S-16774,ACCURATE INSTITUTE OF MANAGEMENT AND TECHNOLOGY,Uttar Pradesh,Gautam Buddha Nagar,2006,Urban,PGDM Institutes,Private Un-Aided
S-134,ACHARYA SCHOOL OF MANAGEMENT,Karnataka,Bengaluru Rural,2009,Urban,PGDM Institutes,Private Un-Aided
S-26339,"ADANI INSTITUTE OF DIGITAL TECHNOLOGY MANAGEMENT, GANDHINAGAR",Gujarat,Gandhinagar,2020,Rural,PGDM Institutes,Private Un-Aided
S-19471,ADARSH COLLEGE OF MANAGEMENT BHOPAL,Madhya Pradesh,Bhopal,-,Rural,PGDM Institutes,Private Un-Aided
S-1,ADMINISTRATIVE STAFF COLLEGE OF INDIA,Telangana,Hyderabad,1956,Urban,PGDM Institutes,Private Aided (Government Aided)
S-22427,"AFFINITY BUSINESS SCHOOL,BARATOTA",Odisha,Khordha,-,Rural,PGDM Institutes,Private Un-Aided
S-18169,Agriculture and Food Management Institute,Karnataka,Mysuru,-,Rural,PGDM Institutes,Private Un-Aided
S-135,AGRICULTURE AND FOOD MANAGEMENT INSTITUTE,Karnataka,Mysuru,-,-,PGDM Institutes,-
S-19939,AHMEDABAD INSTITUTE OF HOSPITALITY MANAGEMENT,Gujarat,Ahmedabad,2021,Rural,PGDM Institutes,Private Un-Aided
S-25999,ALDEL INSTITUTE OF MANAGEMENT,Maharashtra,Palghar,2024,Urban,PGDM Institutes,Private Un-Aided
S-2,ALWAR SCHOOL OF BUSINESS AND COMPUTERS,Andhra Pradesh,Visakhapatnam,2008,Urban,PGDM Institutes,Private Un-Aided
S-496,AMBEDKAR INSTITUTE OF MANAGEMENT STUDIES,Andhra Pradesh,Visakhapatnam,1995,Rural,PGDM Institutes,Private Un-Aided
S-20582,AMBIKA COLLEGE OF MANAGEMENT,Madhya Pradesh,Gwalior,2020,Urban,PGDM Institutes,Private Aided (Government Aided)
S-19483,ANSH COLLEGE OF MANAGEMENT,Madhya Pradesh,Gwalior,2020,Urban,PGDM Institutes,Private Un-Aided
S-20819,APEEJAY INSTITUTE OF MASS COMMUNICATION,Delhi,South West,2003,Urban,PGDM Institutes,Private Un-Aided
S-757,APEEJAY SCHOOL OF MANAGEMENT,Delhi,South West,1993,Urban,PGDM Institutes,Private Un-Aided
S-21007,ASHAA KIRANN BUSINESS SCHOOL,Odisha,Khordha,-,Rural,PGDM Institutes,Private Un-Aided
S-22571,ASHOKA SCHOOL OF BUSINESS,Telangana,YADADRI BHUVANAGIRI,-,Rural,PGDM Institutes,Private Un-Aided
S-14545,ASIAN BUSINESS SCHOOL,Uttar Pradesh,Gautam Buddha Nagar,2011,Urban,PGDM Institutes,Private Un-Aided
S-53,ASIA-PACIFIC INSTITUTE OF MANAGEMENT,Delhi,South,1996,Urban,PGDM Institutes,Private Un-Aided
S-17686,"ASMs Institute of Business Management and Research(PGDM), Pune",Maharashtra,Pune,2018,Urban,PGDM Institutes,Private Un-Aided
S-14905,Assam Institute of Management,Assam,Kamrup Metro,1988,Urban,PGDM Institutes,State Government
S-20876,ATHARVA SCHOOL OF BUSINESS,Maharashtra,Mumbai Suburban,2020,Urban,PGDM Institutes,Private Un-Aided
S-19657,ATLAS IDEAL INTERNATIONAL COLLEGE,Kerala,Malappuram,-,Rural,PGDM Institutes,Private Un-Aided
S-23201,"AUREOLE SCHOOL OF BUSINESS  MANAGEMENT, PUNE",Maharashtra,Pune,2018,Rural,PGDM Institutes,Private Un-Aided
S-21108,AURORAS BUSINESS SCHOOL,Telangana,Hyderabad,-,Urban,PGDM Institutes,Private Un-Aided
S-23812,AURORA S MANAGEMENT ACADEMY,Telangana,Hyderabad,-,Urban,PGDM Institutes,Private Un-Aided
S-23811,AURORAS SCHOOL OF BUSINESS STUDIES,Telangana,MEDCHAL MALKAJGIRI,-,Urban,PGDM Institutes,Private Un-Aided
S-349,AUROUS INSTITUTE OF MANAGEMENT,Uttar Pradesh,Bara Banki,2010,Rural,PGDM Institutes,Private Aided (Government Aided)
S-26658,AVANTHIS SCHOOL OF BUSINESS  MANAGEMENT,Telangana,Hyderabad,2022,Urban,PGDM Institutes,Private Un-Aided
S-25819,BADRUKA SCHOOL OF MANAGEMENT ,Telangana,MEDCHAL MALKAJGIRI,2024,Rural,PGDM Institutes,Private Un-Aided
S-19644,BAFNA COLLEGE,Madhya Pradesh,Jhabua,-,Urban,PGDM Institutes,Private Un-Aided
S-26206,BANDHAN SCHOOL OF BUSINESS,West Bengal,Birbhum,2024,Rural,PGDM Institutes,Private Un-Aided
S-20813,BANGALORE MANAGEMENT INSTITUTE,Karnataka,Bengaluru Urban,-,Urban,PGDM Institutes,Private Un-Aided
S-19659,BHAGWATI INSTITUTE OF PROFESSIONAL STUDIES,Uttar Pradesh,Ghaziabad,2020,Urban,PGDM Institutes,Private Un-Aided
S-54,BHARATIYA VIDYA BHAVAN'S USHA AND LAKSHMI MITTAL INSTITUTE OF MANAGEMENT,Delhi,Central,-,Urban,PGDM Institutes,Central Government
S-14751,"BHAVAN'S CENTRE FOR COMMUNICATION AND MANAGEMENT, KHARVELANAGAR",Odisha,Khordha,2006,Urban,PGDM Institutes,Private Un-Aided
S-16675,BHAVAN S PRIYAMVADA BIRLA INSTITUTE OF MANAGEMENT,Karnataka,Mysuru,2011,Urban,PGDM Institutes,Private Un-Aided
S-20278,BHUBANESWAR INSTITUTE OF MANAGEMENT STUDIES,Odisha,Khordha,2021,Rural,PGDM Institutes,Private Un-Aided
S-354,BIRLA INSTITUTE OF MANAGEMENT TECHNOLOGY,Uttar Pradesh,Gautam Buddha Nagar,1988,Urban,PGDM Institutes,Private Un-Aided
S-14546,BUNTS SANGHA'S UMA KRISHNA SHETTY INSTITUTE OF MANAGEMENT STUDIES AND RESEARCH,Maharashtra,Mumbai,2012,Urban,PGDM Institutes,Private Un-Aided
S-484,CALCUTTA BUSINESS SCHOOL,West Bengal,North 24 Parganas,2013,Urban,PGDM Institutes,Private Un-Aided
S-198,CENTRE FOR ADVANCED EDUCATION INSTITUTE OF MANAGEMENT TECHNOLOGY,Maharashtra,Nagpur,2004,Rural,PGDM Institutes,Private Un-Aided
S-7,CENTRE FOR MANAGEMENT AND TECHNOLOGY (CMT),Andhra Pradesh,Visakhapatnam,2010,Urban,PGDM Institutes,Private Un-Aided
S-40,CHANDRAGUPT INSTITUTE OF MANAGEMENT PATNA,Bihar,Patna,2008,Urban,PGDM Institutes,State Government
S-19567,CH CHARAN SINGH NATIONAL INSTITUTE OF AGRICULTURAL MARKETING,Rajasthan,Jaipur,1988,Urban,PGDM Institutes,Central Government
S-200,CHETANA'S INSTITUTE OF MANAGEMENT AND RESEARCH,Maharashtra,Mumbai Suburban,1996,Urban,PGDM Institutes,Private Un-Aided
S-14904,Christ Institute of Management,Uttar Pradesh,Ghaziabad,2014,Urban,PGDM Institutes,Private Un-Aided
S-360,C-MAT BUSINESS SCHOOL,Uttar Pradesh,Gautam Buddha Nagar,2010,Urban,PGDM Institutes,Private Un-Aided
S-139,DAYANANDA SAGAR BUSINESS SCHOOL,Karnataka,Bengaluru Urban,2007,Urban,PGDM Institutes,Private Un-Aided
S-22465,DC BUSINESS SCHOOL,Madhya Pradesh,Indore,-,Urban,PGDM Institutes,Private Un-Aided
S-20408,DELHI SCHOOL OF BUSINESS,Delhi,North West,2012,Urban,PGDM Institutes,Private Un-Aided
S-14886,DES Institute of Management Development and Research,Maharashtra,Pune,1974,Urban,PGDM Institutes,Private Un-Aided
S-15033,Development Management Institute,Bihar,Patna,2014,Urban,PGDM Institutes,Private Un-Aided
S-366,DEWAN V.S. INSTITUTE OF MANAGEMENT,Uttar Pradesh,Meerut,-,Urban,PGDM Institutes,-
S-17659,Dhruva College of Management,Telangana,MEDCHAL MALKAJGIRI,-,Urban,PGDM Institutes,Private Aided (Government Aided)
S-482,DOON BUSINESS SCHOOL GLOBAL,Uttarakhand,Dehradun,2009,Urban,PGDM Institutes,Private Un-Aided
S-16736,DR. D. Y. PATIL B-SCHOOL,Maharashtra,Pune,2017,Urban,PGDM Institutes,Private Un-Aided
S-22466,DR D Y PATIL PRATISHTHANS D Y PATIL PGDM INSTITUTE AKURDI PUNE,Maharashtra,Pune,-,Urban,PGDM Institutes,Private Un-Aided
S-368,DR.GAUR HARI SINGHANIA INSTITUTE OF MANGEMENT AND RESEARCH,Uttar Pradesh,Kanpur Nagar,1995,Urban,PGDM Institutes,Private Un-Aided
S-20736,DR MAR THEOPHILUS INSTITUTE OF MANAGEMENT STUDIES,Maharashtra,Thane,2021,Urban,PGDM Institutes,Private Un-Aided
S-19698,DURGADEVI SARAF GLOBAL BUSINESS SCHOOL,Maharashtra,Mumbai Suburban,2011,Urban,PGDM Institutes,Private Un-Aided
S-25818,DUXFORD INTERNATIONAL BUSINESS SCHOOL    ,Kerala,Malappuram,2023,Rural,PGDM Institutes,Private Un-Aided
S-12,ENGINEERING STAFF COLLEGE OF INDIA,Telangana,Hyderabad,2008,Urban,PGDM Institutes,Private Un-Aided
S-19107,Entreneurship  Management Processes International New Delhi,Delhi,South,1995,Urban,PGDM Institutes,Private Un-Aided
S-88,ENTREPRENEURSHIP DEVELOPMENT INSTITUTE OF INDIA,Gujarat,Gandhinagar,1983,Rural,PGDM Institutes,Private Un-Aided
S-21486,EVERGREEN EDUCATION SOCIETY COLLEGE KIWLARI SOHAGPUR,Madhya Pradesh,Narmadapuram,-,Rural,PGDM Institutes,Private Un-Aided
S-19661,EXCEL BUSINESS SCHOOL INDORE,Madhya Pradesh,Indore,-,Rural,PGDM Institutes,Private Un-Aided
S-16927,Firebird Institute of Research in Management,Tamil Nadu,Coimbatore,2017,Rural,PGDM Institutes,Private Un-Aided
S-17630,"Food and Agri Business School PGDM (ABM) , Sagar Group of Institutions",Telangana,Ranga Reddy,2009,Rural,PGDM Institutes,Private Un-Aided
S-62,FORE SCHOOL OF MANAGEMENT,Delhi,South,1994,Urban,PGDM Institutes,Private Un-Aided
S-770,FORTUNE INSTITUTE OF INTERNATIONAL BUSINESS,Delhi,South,1995,Urban,PGDM Institutes,Private Aided (Government Aided)
S-766,FOSTIIMA Business School,Delhi,South West,2010,Urban,PGDM Institutes,Private Un-Aided
S-21331,GL BAJAJ INSTITUTE OF MANAGEMENT AND RESEARCH PGDM INSTITUTE,Uttar Pradesh,Gautam Buddha Nagar,-,Urban,PGDM Institutes,Private Un-Aided
S-19502,GLOBAL INSTITUTE OF BUSINESS STUDIES,Karnataka,Bengaluru Urban,2020,Urban,PGDM Institutes,Private Un-Aided
S-14851,GLOBSYN BUSINESS SCHOOL,West Bengal,South 24 Parganas,2011,Rural,PGDM Institutes,Private Un-Aided
S-19469,GNIOT INSTITUTE OF MANAGEMENT STUDIES,Uttar Pradesh,Gautam Buddha Nagar,2020,Urban,PGDM Institutes,Private Un-Aided
S-87,GOA INSTITUTE OF MANAGEMENT,Goa,North Goa,1993,Rural,PGDM Institutes,Private Un-Aided
S-20550,GRANTHAMM COLLEGE OF MANAGEMENT,Madhya Pradesh,Gwalior,2020,Urban,PGDM Institutes,Private Un-Aided
S-22409,"GREATER NOIDA INSTITUTE OF MANAGEMENT, GREATER NOIDA",Uttar Pradesh,Gautam Buddha Nagar,-,Urban,PGDM Institutes,Private Un-Aided
S-327,GREAT LAKES INSTITUTE OF MANAGEMENT,Tamil Nadu,Chennai,2004,Rural,PGDM Institutes,Private Un-Aided
S-17295,"Great Lakes Institute of Management, Gurgaon",Haryana,Gurugram,2016,Urban,PGDM Institutes,Private Un-Aided
S-18432,GURUKUL ACADEMY,Madhya Pradesh,Indore,-,Rural,PGDM Institutes,Private Un-Aided
S-204,GURUNANAK INSTITUTE OF MANAGEMENT STUDIES,Maharashtra,Mumbai,2002,Urban,PGDM Institutes,Private Un-Aided
S-18430,GYANKUNJ INTERNATIONAL,Madhya Pradesh,Khargone (West Nimar),-,Rural,PGDM Institutes,Private Un-Aided
S-19348,HAL MANAGEMENT ACADEMY,Karnataka,Bengaluru Urban,-,Urban,PGDM Institutes,Central Government
S-15315,HLM BUSINESS SCHOOL,Uttar Pradesh,Ghaziabad,2010,Rural,PGDM Institutes,Private Un-Aided
S-20547,IAEER PIBMS INSTITUTE OF PGDM,Maharashtra,Pune,2019,Rural,PGDM Institutes,Private Un-Aided
S-119,IBMR BUSINESS SCHOOL,Haryana,Jhajjar,2008,Rural,PGDM Institutes,Private Un-Aided
S-18094,I Business Institute,Uttar Pradesh,Gautam Buddha Nagar,2008,Urban,PGDM Institutes,Private Un-Aided
S-25,ICAR NATIONAL ACADEMY OF AGRICULTURAL RESEARCH MANAGEMENT,Telangana,Hyderabad,1976,Urban,PGDM Institutes,Central Government
S-19001,ICAR NATIONAL ACADEMY OF AGRICULTURAL RESEARCH MANAGEMENT,Telangana,Ranga Reddy,-,Urban,PGDM Institutes,Central Government
S-17598,ICA-The Institute of Certified  Accountants,Kerala,Malappuram,-,Urban,PGDM Institutes,Private Un-Aided
S-483,IDEAL BUSINESS SCHOOL,Uttarakhand,Haridwar,2011,Rural,PGDM Institutes,Private Aided (Government Aided)
S-386,IEM INSTITUTE OF BUSINESS MANAGEMENT,Uttar Pradesh,Bara Banki,2009,Rural,PGDM Institutes,Private Un-Aided
S-205,IES's Management College and Research Centre,Maharashtra,Mumbai,1998,Urban,PGDM Institutes,Private Un-Aided
S-21864,IIITM EDUCATION INDIA,The Dadra and Nagar Haveli and Daman and Diu,Daman,-,Urban,PGDM Institutes,Private Un-Aided
S-389,IILM GRADUATE SCHOOL OF MANAGEMENT,Uttar Pradesh,Gautam Buddha Nagar,1993,Urban,PGDM Institutes,Private Un-Aided
S-16690,IMI Bhubaneswar,Odisha,Khordha,2011,Rural,PGDM Institutes,Private Un-Aided
S-18984,IMI Business School,Madhya Pradesh,Indore,2019,Urban,PGDM Institutes,Private Un-Aided
S-17631,IMI DELHI,Delhi,South,1981,Urban,PGDM Institutes,Private Un-Aided
S-10917,IMI Kolkata,West Bengal,South 24 Parganas,2011,Urban,PGDM Institutes,Private Un-Aided
S-19834,IMPERIAL INSTITUTION OF MANAGEMENT GWALIOR,Madhya Pradesh,Gwalior,-,Rural,PGDM Institutes,Private Un-Aided
S-14894,"INDIAN INSTITUTE OF FINANCE, GREATER NOIDA",Uttar Pradesh,Gautam Buddha Nagar,1987,Urban,PGDM Institutes,Private Un-Aided
S-25926,INDIAN INSTITUTE OF MATERIALS MANAGEMENT,Maharashtra,Mumbai,2018,Urban,PGDM Institutes,Private Un-Aided
S-485,INDIAN INSTITUTE OF SOCIAL WEFLFARE & BUSINESS MANAGEMENT,West Bengal,Kolkata,1953,Urban,PGDM Institutes,Private Aided (Government Aided)
S-207,INDIRA SCHOOL OF BUSINESS STUDIES PGDM,Maharashtra,Pune,2006,Urban,PGDM Institutes,Private Un-Aided
S-18429,INDORE INTERNATIONAL COLLEGE,Madhya Pradesh,Indore,-,Urban,PGDM Institutes,Private Un-Aided
S-176,INDORE MANAGEMENT INSTITUTE AND RESEARCH CENTRE,Madhya Pradesh,Indore,2009,Rural,PGDM Institutes,Private Un-Aided
S-142,INDUS BUSINESS ACADEMY,Karnataka,Bengaluru Rural,2010,Rural,PGDM Institutes,Private Aided (Government Aided)
S-14766,"INNOVATION-THE BUSINESS SCHOOL, MUKTAPUR, KHURDA",Odisha,Khordha,2009,Rural,PGDM Institutes,Private Un-Aided
S-394,INSITITUTE OF MANAGEMENT TECHNOLOGY GHAZIABAD,Uttar Pradesh,Ghaziabad,1980,Urban,PGDM Institutes,Private Aided (Government Aided)
S-208,INSTITUTE FOR FUTURE EDUCATION ENTREPRENEURSHIP AND LEADERSHIP,Maharashtra,Pune,2010,Rural,PGDM Institutes,Private Un-Aided
S-10909,INSTITUTE OF ADVANCED MANAGEMENT NORTH 24 PARGANAS,West Bengal,North 24 Parganas,1995,Urban,PGDM Institutes,Private Un-Aided
S-13791,"INSTITUTE OF BUSINESS MANAGEMENT, BUDHMARG PATNA",Bihar,Patna,1979,Urban,PGDM Institutes,Private Un-Aided
S-17306,INSTITUTE OF INSURANCE AND RISK MANAGEMENT(IIRM),Telangana,Ranga Reddy,2003,Rural,PGDM Institutes,Private Un-Aided
S-16245,Institute of Management And Information Science,Odisha,Khordha,1995,Urban,PGDM Institutes,Private Un-Aided
S-278,INSTITUTE OF MANAGEMENT BHUBANESWAR,Odisha,Khordha,1995,Urban,PGDM Institutes,Private Un-Aided
S-22621,INSTITUTE OF MANAGEMENT EDUCATION AND CONSULTANCY,Uttarakhand,Udham Singh Nagar,-,-,PGDM Institutes,Private Un-Aided
S-26626,INSTITUTE OF MANAGEMENT SCIENCE PATNA,Bihar,Patna,2025,Rural,PGDM Institutes,Private Un-Aided
S-402,INSTITUTE OF MANAGEMENT STUDIES,Uttar Pradesh,Ghaziabad,1990,Urban,PGDM Institutes,Private Un-Aided
S-19468,INSTITUTE OF MANAGEMENT TECHNOLOGY CENTRE FOR DISTANCE LEARNING GHAZIABAD,Uttar Pradesh,Ghaziabad,2006,Urban,PGDM Institutes,Private Un-Aided
S-26286,INSTITUTE OF MANAGEMENT TECHNOLOGY HYDERABAD,Telangana,Ranga Reddy,2011,Rural,PGDM Institutes,Private Un-Aided
S-14562,"INSTITUTE OF MANAGEMENT TECHNOLOGY, HYDERABAD",Telangana,Hyderabad,2011,Urban,PGDM Institutes,Private Un-Aided
S-12874,"INSTITUTE OF MARKETING AND MANAGEMENT, QUTAB INSTITUTIONAL AREA",Delhi,South,1969,Urban,PGDM Institutes,Private Aided (Government Aided)
S-14516,"INSTITUTE OF PRODUCTIVITY AND MANAGEMENT, LUCKNOW",Uttar Pradesh,Lucknow,-,Urban,PGDM Institutes,Private Un-Aided
S-14542,"INSTITUTE OF PUBLIC ENTERPRISE, SHAMIRPET (V&M), HYDERABAD",Telangana,MEDCHAL MALKAJGIRI,1964,Rural,PGDM Institutes,Private Un-Aided
S-305,INSTITUTE OF RURAL MANAGEMENT,Rajasthan,Jaipur,1994,Urban,PGDM Institutes,Private Un-Aided
S-92,Institute of Rural Management Anand (IRMA),Gujarat,Anand,1979,Urban,PGDM Institutes,Private Un-Aided
S-17594,Institute of Science and Management,Jharkhand,Ranchi,1985,Urban,PGDM Institutes,Private Un-Aided
S-578,INTEGRAL INSTITUTE OF ADVANCED MANAGEMENT (IIAM),Andhra Pradesh,Visakhapatnam,1987,Urban,PGDM Institutes,Private Un-Aided
S-21485,INTERNATIONAL  INSTITUTE OF BUSINESS STUDY,Karnataka,Bengaluru Urban,-,Urban,PGDM Institutes,Private Un-Aided
S-70,INTERNATIONAL INSTITUTE OF HEALTH MANAGEMENT RESEARCH,Delhi,South West,2008,Urban,PGDM Institutes,Private Un-Aided
S-10916,INTERNATIONAL INSTITUTE OF HOTEL MAGEMENT NORTH 24 PARGANAS,West Bengal,Kolkata,1998,Urban,PGDM Institutes,Private Un-Aided
S-216,INTERNATIONAL INSTITUTE OF MANAGEMENT STUDIES,Maharashtra,Pune,2008,Rural,PGDM Institutes,Private Un-Aided
S-26471,INTERNATIONAL MANAGEMENT AND ANALYTICS SCHOOL KOLKATA,West Bengal,South 24 Parganas,2025,Rural,PGDM Institutes,Private Un-Aided
S-18276,INTERNATIONAL SCHOOL OF BUSINESS ADMINISTRATION,Madhya Pradesh,Indore,-,Rural,PGDM Institutes,Private Un-Aided
S-19654,INTERNATIONAL SCHOOL OF BUSINESS ADMINISTRATION,Madhya Pradesh,Neemuch,-,Rural,PGDM Institutes,Private Aided (Government Aided)
S-20560,INTERNATIONAL SCHOOL OF BUSINESS ADMINISTRATION SANWER,Madhya Pradesh,Indore,-,Rural,PGDM Institutes,Private Un-Aided
S-217,INTERNATIONAL SCHOOL OF BUSINESS AND MEDIA,Maharashtra,Pune,2008,Rural,PGDM Institutes,Private Un-Aided
S-21330,INTERNATIONAL SCHOOL OF BUSINESS AND MEDIA,Karnataka,Bengaluru Rural,2005,Rural,PGDM Institutes,Private Un-Aided
S-20416,INTERNATIONAL SCHOOL OF BUSINESS AND MEDIA KOLKATA,West Bengal,South 24 Parganas,2017,Rural,PGDM Institutes,Private Un-Aided
S-17777,International School of Management Excellence,Karnataka,Bengaluru Urban,2006,Urban,PGDM Institutes,Private Un-Aided
S-14956,INTERNATIONAL SCHOOL OF MANAGEMENT PATNA,Bihar,Patna,2011,Rural,PGDM Institutes,Private Un-Aided
S-280,INTERSCIENCE INSTITUTE OF MANAGEMENT AND TECHNOLOGYBHUBANESWAR,Odisha,Khordha,2008,Rural,PGDM Institutes,Private Aided (Government Aided)
S-19655,ISBA COLLEGE,Madhya Pradesh,Neemuch,-,Rural,PGDM Institutes,Private Un-Aided
S-23771,ISBM SCHOOL OF COMMUNICATION AND MEDIA MANAGEMENT,Maharashtra,Pune,2023,Rural,PGDM Institutes,Private Un-Aided
S-145,ISBR BUSINESS SCHOOL,Karnataka,Bengaluru Urban,2010,Urban,PGDM Institutes,Private Un-Aided
S-23282,ISMS TBS,Maharashtra,Pune,2023,Rural,PGDM Institutes,Private Un-Aided
S-19651,ITM BUSINESS SCHOOL WARANGAL,Telangana,Warangal,-,Urban,PGDM Institutes,Private Un-Aided
S-19478,ITS SCHOOL OF MANAGEMENT,Uttar Pradesh,Ghaziabad,2020,Urban,PGDM Institutes,Private Un-Aided
S-20903,JAGAN INSTITUTE OF MANAGEMENT STUDIES,Rajasthan,Jaipur,2006,Rural,PGDM Institutes,Private Un-Aided
S-782,JAGAN INSTITUTE OF MANAGEMENT STUDIES TECHNICAL CAMPUS,Delhi,North West,-,-,PGDM Institutes,-
S-74,JAGANNATH INTERNATIONAL MANAGEMENT SCHOOL,Delhi,South,1997,Urban,PGDM Institutes,Private Un-Aided
S-144,JAGDISH SHETH SCHOOL OF MANAGEMENT,Karnataka,Bengaluru Urban,1995,Urban,PGDM Institutes,Private Un-Aided
S-20409,JAI MAA PITAMBRA COLLEGE OF MANAGEMENT,Madhya Pradesh,Datia,-,Urban,PGDM Institutes,Private Un-Aided
S-309,JAIPURIA INSTITUTE OF MANAGEMENT,Rajasthan,Jaipur,2006,Urban,PGDM Institutes,Private Un-Aided
S-179,JAIPURIA INSTITUTE OF MANAGEMENT INDORE,Madhya Pradesh,Indore,2010,Rural,PGDM Institutes,Private Un-Aided
S-3283,"JAIPURIA INSTITUTE OF MANAGEMENT, NOIDA",Uttar Pradesh,Gautam Buddha Nagar,2004,Urban,PGDM Institutes,Private Un-Aided
S-419,JAIPURIA ISNTITUTE OF MANAGEMENT LUCKNOW,Uttar Pradesh,Lucknow,1995,Urban,PGDM Institutes,Private Un-Aided
S-418,"JAIPURIA SCHOOL OF BUSINESS, GAZIABAD",Uttar Pradesh,Ghaziabad,2008,Urban,PGDM Institutes,Private Un-Aided
S-420,JANHIT SCHOOL OF MANAGEMENT,Uttar Pradesh,Ghaziabad,2009,Rural,PGDM Institutes,Private Un-Aided
S-21049,JAYADEVA BUSINESS SCHOOL,Odisha,Khordha,-,Urban,PGDM Institutes,Private Un-Aided
S-21480,JIO INSTITUTE,Maharashtra,Raigad,-,Urban,PGDM Institutes,Private Un-Aided
S-111,JK BUSINESS SCHOOL,Haryana,Gurugram,-,Rural,PGDM Institutes,Private Un-Aided
S-19403,JPB COLLEGE,Madhya Pradesh,Vidisha,2019,Rural,PGDM Institutes,Private Un-Aided
S-10923,JYOTIRMOY SCHOOL OF BUSINESS KOLKATA,West Bengal,Kolkata,2010,Urban,PGDM Institutes,Private Un-Aided
S-26415,KALINGA INSTITUTE OF MANAGEMENT AND TECHNOLOGY,Odisha,Khordha,2025,Urban,PGDM Institutes,Private Un-Aided
S-1171,KEJRIWAL INSTITUTE OF MANAGEMENT AND DEVELOPMENT STUDIES,Jharkhand,Ranchi,2009,Rural,PGDM Institutes,Private Un-Aided
S-21313,KIRLOSKAR INSTITUTE OF MANAGEMENT,Karnataka,Davanagere,-,Urban,PGDM Institutes,Private Un-Aided
S-17687,"KIRLOSKAR INSTITUTE OF MANAGEMENT, PUNE",Maharashtra,Pune,2010,Rural,PGDM Institutes,Private Un-Aided
S-18353,K. K. VYAVSIK ADHAYAYAN MAHAVIDHYALAYA,Madhya Pradesh,Indore,-,Urban,PGDM Institutes,Private Un-Aided
S-21910,KMCT SCHOOL OF MANAGEMENT,Kerala,Kozhikode,-,Rural,PGDM Institutes,Private Un-Aided
S-222,KOHINOOR MANAGEMENT SCHOOL,Maharashtra,Mumbai,2020,Urban,PGDM Institutes,Private Un-Aided
S-283,KRUPAJAL BUSINESS SCHOOL,Odisha,Khordha,2007,Rural,PGDM Institutes,Private Un-Aided
S-19653,KRUPANIDHI SCHOOL OF MANAGEMENT,Karnataka,Bengaluru Urban,2020,Urban,PGDM Institutes,Central Government
S-75,LAL BAHADUR SHASTRI INSTITUTE OF MANAGEMENT,Delhi,South West,-,Urban,PGDM Institutes,Private Un-Aided
S-3305,Lal Bahadur Shastri Institute of Management and Technology,Uttar Pradesh,Bareilly,1996,Rural,PGDM Institutes,Private Un-Aided
S-19401,LAL BAHADUR SHASTRI INSTITUTE OF MANAGEMENT INDORE,Madhya Pradesh,Indore,2020,Rural,PGDM Institutes,Central Government
S-22462,LEADERS COLLEGE,Kerala,Kannur,-,Urban,PGDM Institutes,Private Un-Aided
S-223,Lexicon Management Institute of Leadership and Excellence,Maharashtra,Pune,2010,Urban,PGDM Institutes,Private Un-Aided
S-435,LLOYD BUSINESS SCHOOL,Uttar Pradesh,Gautam Buddha Nagar,2008,Urban,PGDM Institutes,Private Un-Aided
S-331,LOYOLA INSTITUTE OF BUSINESS ADMINISTRATION,Tamil Nadu,Chennai,1979,Urban,PGDM Institutes,Private Un-Aided
S-19051,MADRAS SCHOOL OF ECONOMICS,Tamil Nadu,Chennai,1993,Urban,PGDM Institutes,Private Un-Aided
S-21911,MAHARAJA AGRASEN BUSINESS SCHOOL,Delhi,North West,-,Urban,PGDM Institutes,Private Un-Aided
S-17633,MALWA INSTITUTE OF MANAGEMENT,Madhya Pradesh,Gwalior,2018,Urban,PGDM Institutes,Private Un-Aided
S-113,MANAGEMENT DEVELOPMENT INSTITUTE,Haryana,Gurugram,-,Urban,PGDM Institutes,Private Un-Aided
S-17678,Management Development Institute Murshidabad,West Bengal,Murshidabad,2014,Rural,PGDM Institutes,Private Un-Aided
S-441,MASCOT INSTITUTE OF MANAGEMENT,Uttar Pradesh,Bareilly,2009,Rural,PGDM Institutes,Private Un-Aided
S-442,MASTER SCHOOL OF MANAGEMENT,Uttar Pradesh,Meerut,1996,Urban,PGDM Institutes,Private Un-Aided
S-1359,MATS INSTITUTE OF MANAGEMENT & ENTREPRENURSHIP,Karnataka,Bengaluru Urban,2008,Rural,PGDM Institutes,Private Un-Aided
S-24239,MCC BOYD TANDON SCHOOL OF BUSINESS    ,Tamil Nadu,Chengalpattu,-,Urban,PGDM Institutes,Private Un-Aided
S-227,MET Institute of Post Graduate Diploma in Management,Maharashtra,Mumbai,2007,Urban,PGDM Institutes,Private Un-Aided
S-14875,MICA,Gujarat,Ahmedabad,1991,Rural,PGDM Institutes,Private Un-Aided
S-1959,MIMA Institute of Management,Maharashtra,Pune,2006,Urban,PGDM Institutes,Private Un-Aided
S-19750,MIT SCHOOL OF DISTANCE EDUCATION,Maharashtra,Pune,2018,Rural,PGDM Institutes,Private Un-Aided
S-21481,MKES INSTITUTE OF MANAGEMENT STUDIES AND RESEARCH,Maharashtra,Mumbai Suburban,-,Urban,PGDM Institutes,Private Un-Aided
S-21909,MKM INSTITUTE OF PGDM,Haryana,Palwal,-,Urban,PGDM Institutes,Private Un-Aided
S-20555,MOTI LAL RASTOGI SCHOOL OF MANAGEMENT,Uttar Pradesh,Lucknow,-,Urban,PGDM Institutes,Private Un-Aided
S-148,M S RAMAIAH INSTITUTE OF MANAGEMENT,Karnataka,Bengaluru Urban,1995,Urban,PGDM Institutes,Private Un-Aided
S-26401,MUTHOOT BUSINESS SCHOOL,Kerala,Ernakulam,2025,Rural,PGDM Institutes,Private Un-Aided
S-19402,MY INSTITUTE OF MANAGEMENT,Madhya Pradesh,Mandsaur,2020,Rural,PGDM Institutes,Private Un-Aided
S-14858,MYRA School of Business,Karnataka,Mysuru,2012,Rural,PGDM Institutes,Private Un-Aided
S-14553,"NATIONAL INSTITUTE OF AGRICULTURAL EXTENSION MANAGEMENT, HYDERABAD",Telangana,Ranga Reddy,1987,Urban,PGDM Institutes,Central Government
S-14565,"NATIONAL INSTITUTE OF BANK MANAGEMENT, PUNE",Maharashtra,Pune,1969,Urban,PGDM Institutes,Private Un-Aided
S-22653,NATIONAL INSTITUTE OF RURAL DEVELOPMENT AND PANCHAYATI RAJ,Telangana,Ranga Reddy,-,Urban,PGDM Institutes,Central Government
S-14750,"NATIONAL INSURANCE ACADEMY, PUNE",Maharashtra,Pune,1980,Urban,PGDM Institutes,Private Un-Aided
S-21329,NEW DELHI INSTITUTE OF INFORMATION AND TECHNOLOGY,Delhi,South East,-,Urban,PGDM Institutes,Private Aided (Government Aided)
S-20413,NEW DELHI INSTITUTE OF INFORMATION TECHNOLOGY AND MANAGEMENT,Delhi,South,-,Urban,PGDM Institutes,Private Un-Aided
S-78,NEW DELHI INSTITUTE OF MANAGEMENT,Delhi,South East,1992,Urban,PGDM Institutes,Private Un-Aided
S-17737,NEW ERA COLLEGE OF MANAGEMENT,Madhya Pradesh,Indore,2017,Rural,PGDM Institutes,Private Un-Aided
S-25296,NICMAR INSTITUTE OF CONSTRUCTION MANAGEMENT AND RESEARCH    ,Haryana,Jhajjar,-,Rural,PGDM Institutes,Private Un-Aided
S-26463,"NIET BUSINESS SCHOOL, GREATER NOIDA",Uttar Pradesh,Gautam Buddha Nagar,2006,Urban,PGDM Institutes,Private Un-Aided
S-448,NIMT GREATER NOIDA,Uttar Pradesh,Gautam Buddha Nagar,2008,Urban,PGDM Institutes,Private Un-Aided
S-313,NIMT INSTITUTE OF MANAGEMENT,Rajasthan,Jaipur,-,-,PGDM Institutes,Private Un-Aided
S-10936,NIPS SCHOOL OF HOTEL MANAGEMENT NORTH 24 PARGANAS,West Bengal,Kolkata,2009,Urban,PGDM Institutes,Private Un-Aided
S-152,NITTE EDUCATION TRUST SCHOOL OF MANAGEMENT,Karnataka,Bengaluru Rural,2009,Rural,PGDM Institutes,Private Un-Aided
S-234,N.L.DALMIA INSTITUTE OF MANAGEMENT STUDIES & RESEARCH,Maharashtra,Thane,1995,Urban,PGDM Institutes,Private Un-Aided
S-22413,NRI SCHOOL OF MANAGEMENT STUDIES,Madhya Pradesh,Bhopal,-,Urban,PGDM Institutes,Private Un-Aided
S-19470,NSB WORLD BUSINESS SCHOOL,Karnataka,Bengaluru Urban,-,Urban,PGDM Institutes,Private Un-Aided
S-10938,NSHM SCHOOL OF HOTEL MANAGEMENT BARDHAMAN,West Bengal,Purba Bardhaman,2009,Urban,PGDM Institutes,Private Un-Aided
S-18097,NTPC School of Business,Uttar Pradesh,Gautam Buddha Nagar,-,Urban,PGDM Institutes,Central Government
S-268,ODM BUSINESS SCHOOL,Odisha,Khordha,2009,Urban,PGDM Institutes,Private Un-Aided
S-19678,OMEGA BUSINESS SCHOOL,Telangana,MEDCHAL MALKAJGIRI,2020,Rural,PGDM Institutes,Private Un-Aided
S-235,ORIENTAL SCHOOL OF BUSINESS,Maharashtra,Thane,2008,Urban,PGDM Institutes,Private Un-Aided
S-18980,OXFORD COLLEGE OF MANAGEMENT,Madhya Pradesh,Indore,-,Rural,PGDM Institutes,Private Un-Aided
S-487,PAILAN COLLEGE OF MANAGEMENT AND TECHNOLOGY (PGDM DIVISION),West Bengal,Kolkata,2013,Urban,PGDM Institutes,Private Un-Aided
S-19474,PARAKH COLLEGE BHOPAL,Madhya Pradesh,Bhopal,2019,Rural,PGDM Institutes,Private Un-Aided
S-14944,PARK GLOBAL SCHOOL OF BUSINESS EXCELLENCE CHENNAI,Tamil Nadu,Kancheepuram,2009,Rural,PGDM Institutes,Private Un-Aided
