Aishe Code,Name,State,District,Year Of Establishment,Location,Standalone Type,Manegement
S-17939,"SATAO NURSING TRAINING SCHOOL, WARDHA",Maharashtra,Wardha,2011,Urban,Nursing,Private Un-Aided
S-5019,SATGURU EDUCATIONAL WELFARE SOCIETY LUDHIANA,Punjab,Ludhiana,2002,Rural,Nursing,Private Un-Aided
S-25431,SAT SCHOOL OF NURSING,Tamil Nadu,Nagapattinam,-,Rural,Nursing,Private Un-Aided
S-3610,SATYABHAMA SCHOOL OF NURSING KADAPA,Andhra Pradesh,Y.S.R. Kadapa,2003,Urban,Nursing,Private Un-Aided
S-26678,SATYA MPHW (MALE) TRAINING SCHOOL,Haryana,Rohtak,2016,Rural,Nursing,Private Un-Aided
S-15649,Satyam Regional Institute of Nursing,Odisha,Deogarh,2014,Urban,Nursing,Private Aided (Government Aided)
S-4263,SATYAM SCHOOL OF NURSING BANGALORE URBAN,Karnataka,Bengaluru Urban,2003,Urban,Nursing,Private Un-Aided
S-4264,SATYAM SCHOOL OF NURSING BELLARY,Karnataka,Ballari,2017,Rural,Nursing,Private Un-Aided
S-17061,SATYAM SHIVAM SUNDARAM SHIKSHAN SANSTHAS UTTAMRAO UMAK MEMO. NURSING TRAINING SCHOOL KAPUSTALNI,Maharashtra,Amravati,2009,Rural,Nursing,Private Un-Aided
S-15720,Satyanarayan ANM Training School,Odisha,Dhenkanal,2008,Urban,Nursing,Private Un-Aided
S-20252,SATYANARAYAN GNM TRAINING COLLEGE,Odisha,Malkangiri,2012,Urban,Nursing,Private Un-Aided
S-22631,SATYANARAYAN GNM TRAINING COLLEGE,Odisha,Koraput,-,Urban,Nursing,Private Un-Aided
S-25717,"SATYA SAI NURSING RESEARCH INSTITUTE, NAUGARHA ",Jharkhand,Palamu,2024,Rural,Nursing,Private Un-Aided
S-5164,SATYA SAI SCHOOL OF NURSING SIKAR,Rajasthan,Sikar,-,-,Nursing,-
S-3609,SATYA SCHOOL OF NURSING GUNTUR,Andhra Pradesh,Guntur,1999,Rural,Nursing,Private Un-Aided
S-21132,"SATYA SRI SCHOOL OF NURSING, KAKINADA",Andhra Pradesh,Kakinada,2018,Urban,Nursing,Private Un-Aided
S-20078,SATYENDRAM NURSING INSTITUTE OF ANM,Bihar,Munger,2020,Rural,Nursing,State Government
S-15819,SAU JEBELINA NURSING SCHOOL GARGOTI,Maharashtra,Kolhapur,2009,Rural,Nursing,Private Un-Aided
S-26568,SAU KALPANABAI UTTAMRAO MAHAJAN INSTITUTE OF NURSING  SHIRPUR DIST DHULE ,Maharashtra,Dhule,2024,Rural,Nursing,Private Un-Aided
S-25381,"SAU MANGALA SUBHASH PATIL SCHOOL OF NURSING DIDOLA BK, MOTALA, BULDHANA",Maharashtra,Buldhana,-,Rural,Nursing,Private Un-Aided
S-4804,SAU MINATAI THAKRE INSTITUTE OF NURSING EDUCATION THANE,Maharashtra,Thane,1996,Urban,Nursing,Local Body
S-21708,SAURABH SCHOOL OF NURSING,Rajasthan,Karauli,-,Rural,Nursing,Private Un-Aided
S-22096,SAURASHTRA COLLEGE OF NURSING,Gujarat,Rajkot,-,Rural,Nursing,Private Un-Aided
S-5165,SAVI INSTITUTE OF NURSING BARMER,Rajasthan,Barmer,2007,Urban,Nursing,Private Un-Aided
S-21877,SAVIOUR COLLEGE OF NURSING,Delhi,New Delhi,-,Urban,Nursing,Private Un-Aided
S-21110,SAVITA SCHOOL OF NURSING,Karnataka,Bengaluru Urban,-,Urban,Nursing,Private Aided (Government Aided)
S-18070,"SAVITHRIBAI PULE NURSING SCHOOL, JALKOT TQ JALKOT",Maharashtra,Latur,2011,Rural,Nursing,State Government
S-20731,SAVITRIBAI FULE ANM AND GNM NURSING SCHOOL GADCHIROLI,Maharashtra,Gadchiroli,-,Rural,Nursing,Private Un-Aided
S-20718,SAVITRIBAI PHULE EDUCATION AND WELFARE SOCIETY TQ DIST PARBHANI SANCHLIT SAHARA GNM NURSING SCHOOL PARBHANI,Maharashtra,Parbhani,-,Urban,Nursing,Private Un-Aided
S-16490,"Savitribai Phule GNM Nursing College, Washim",Maharashtra,Washim,2011,Urban,Nursing,Private Un-Aided
S-25257,SAVITRIBAI PHULE INSTITUTE OF NURSING COLLEGE KILLARI TQ AUSA DIST LATUR,Maharashtra,Latur,-,Rural,Nursing,Private Un-Aided
S-17952,"Savitribai Phule Nursing School, Kannad",Maharashtra,Chhatrapati Sambhajinagar,2011,Rural,Nursing,Private Un-Aided
S-20727,SAVITRIBAI PHULE NURSING SCHOOL LASUR STATION,Maharashtra,Chhatrapati Sambhajinagar,2021,Rural,Nursing,Private Un-Aided
S-25727,SAVITRIBAI PHULE NURSING SCHOOL MANWAT,Maharashtra,Parbhani,2024,Rural,Nursing,Private Un-Aided
S-26143,SAVITRI DEVI NURSING INSTITUTE UDAIRAMSAR,Rajasthan,Bikaner,2021,Rural,Nursing,Private Un-Aided
S-20940,SAVITRI JINDAL INSTITUTE OF NURSING UNDER OM SAVITRI JINDAL CHARITABLE SOCIETY MODEL TOWN HISAR,Haryana,Hisar,2013,Urban,Nursing,Private Un-Aided
S-19830,SAVITRI NURSING AND PARAMEDICAL COLLEGE,Uttar Pradesh,Prayagraj,2020,Rural,Nursing,State Government
S-22720,SAVITRI NURSING PARAMEDICAL TRAINIING SANSTHAN,Bihar,Gopalganj,-,Rural,Nursing,Private Un-Aided
S-20178,SAVITRI NURSING TRAINING SCHOOL,Bihar,Nawada,2019,Rural,Nursing,Private Un-Aided
S-17051,SAWALI SCHOOL OF NURSING,Maharashtra,Ahilyanagar,2011,Rural,Nursing,Private Un-Aided
S-19571,S B G M PARAMEDICAL INSTITUTE  SHOPIAN KASHMIR,Jammu and Kashmir,Shopian,2013,Rural,Nursing,Private Un-Aided
S-23785,S B K COLLEGE OF NURSING,Maharashtra,Bhandara,2023,Rural,Nursing,Private Un-Aided
S-20155,S B SCHOOL OF NURSING,West Bengal,Uttar Dinajpur,2020,Rural,Nursing,Private Aided (Government Aided)
S-4235,S B SCHOOL OF NURSING BANGALORE URBAN,Karnataka,Bengaluru Urban,2003,Urban,Nursing,Private Un-Aided
S-20836,S B SHARMA COLLEGE OF NURSING AND RESEARCH,Gujarat,Jamnagar,2021,Urban,Nursing,Private Un-Aided
S-22474,SCAMEWO SCHOOL OF NURSING,Assam,Goalpara,-,Rural,Nursing,Private Un-Aided
S-22542,"SCAMEWO SCHOOL OF NURSING, SIVASAGAR",Assam,Sivasagar,-,Urban,Nursing,Private Un-Aided
S-17820,SCHOOL OF ANM/FHW IMPHAL MEDICAL DIRECTORATE,Manipur,Imphal West,1970,Urban,Nursing,State Government
S-17855,"SCHOOL OF NURSING ,AKG MEMORIAL CO-OPERATIVE HOSPITAL",Kerala,Kannur,-,Rural,Nursing,State Government
S-4570,SCHOOL OF NURSING ALATHUR PALAKKAD,Kerala,Palakkad,2001,Rural,Nursing,Private Un-Aided
S-4571,SCHOOL OF NURSING ALLAPUZHA,Kerala,Alappuzha,1964,Urban,Nursing,State Government
S-4580,SCHOOL OF NURSING ALUVA ERNAKULAM,Kerala,Ernakulam,2013,Rural,Nursing,Private Un-Aided
S-15459,"School of Nursing (ANM) , Plot No  N-5/157, Nayapalli, Dist - Khurda , Bhubaneswar, Odisha 751015",Odisha,Khordha,2010,Urban,Nursing,Private Un-Aided
S-4574,SCHOOL OF NURSING ARUNAPURAM KOTTAYAM,Kerala,Kottayam,1983,Urban,Nursing,Private Un-Aided
S-3791,"SCHOOL OF NURSING, ATMAVALLABH HOSPITAL, IDAR",Gujarat,Sabar Kantha,2009,Urban,Nursing,Private Un-Aided
S-3709,"SCHOOL OF NURSING , BAPTIST CHRISTIAN HOSPITAL, TEZPUR",Assam,Sonitpur,1954,Urban,Nursing,Private Aided (Government Aided)
S-13866,"SCHOOL OF NURSING, BAPTIST CHRISTIAN HOSPITAL, TEZPUR",Assam,Sonitpur,-,-,Nursing,-
S-4806,SCHOOL OF NURSING BEED,Maharashtra,Beed,1983,Urban,Nursing,State Government
S-4266,SCHOOL OF NURSING BELGAUM,Karnataka,Belagavi,1917,Urban,Nursing,State Government
S-17842,"School of Nursing, Bhagini Mandal, Dhangar",Maharashtra,Jalgaon,2008,Rural,Nursing,Private Un-Aided
S-21593,"SCHOOL OF NURSING , BOKARO GENERAL HOSPITAL",Jharkhand,Bokaro,-,Urban,Nursing,Central Government
S-3696,"SCHOOL OF NURSING, BURROWS MEMORIAL CHRISTIAN HOSPITAL",Assam,Cachar,-,-,Nursing,Local Body
S-4576,SCHOOL OF NURSING CALICUT,Kerala,Kozhikode,2004,Urban,Nursing,Local Body
S-15735,"School of Nursing, Cama And Albless Hospital, Mumbai",Maharashtra,Mumbai,-,Urban,Nursing,State Government
S-16444,"SCHOOL OF NURSING, CENTRAL HOSPITAL KALNA",West Bengal,Purba Bardhaman,2013,Rural,Nursing,Private Un-Aided
S-4577,SCHOOL OF NURSING CHAZHIKATTU HOSPITALS (P) LTD. DUKKI,Kerala,Idukki,2009,Urban,Nursing,Private Un-Aided
S-13983,"SCHOOL OF NURSING, CHC & REFERAL HOSPITAL , VYARA",Gujarat,Tapi,2008,Rural,Nursing,State Government
S-4267,SCHOOL OF NURSING CHIGATERI,Karnataka,Davanagere,1985,Urban,Nursing,State Government
S-5398,SCHOOL OF NURSING CHRISTIAN HOSPITAL,Uttar Pradesh,Kasganj,1925,Urban,Nursing,Private Un-Aided
S-20180,SCHOOL OF NURSING CHRISTIAN HOSPITAL,Madhya Pradesh,Indore,1928,Urban,Nursing,Private Un-Aided
S-3783,"SCHOOL OF NURSING, CIVIL HOSPITAL, AHMEDABAD",Gujarat,Ahmedabad,1954,Urban,Nursing,State Government
S-5022,SCHOOL OF NURSING CIVIL HOSPITAL JALANDHAR,Punjab,Jalandhar,2010,Urban,Nursing,State Government
S-12912,"SCHOOL OF NURSING, COIMBATORE MEDICAL COLLEGE & HOSPITAL, COIMBATORE",Tamil Nadu,Coimbatore,1935,Urban,Nursing,State Government
S-5224,"SCHOOL OF NURSING, CSI RAINY MULTISPECIALITY HOSPITAL, CHENNAI",Tamil Nadu,Chennai,1923,Urban,Nursing,Private Un-Aided
S-5481,SCHOOL OF NURSING DEVA ROAD LUCKNOW,Uttar Pradesh,Lucknow,2003,Urban,Nursing,Local Body
S-4578,SCHOOL OF NURSING DHANLAKSHMI HOSPITAL KANNUR,Kerala,Kannur,2001,Urban,Nursing,Private Un-Aided
S-16073,SCHOOL OF NURSING DISTRICT HOSPITAL FOR WOMEN S AMRAVATI,Maharashtra,Amravati,1959,Urban,Nursing,State Government
S-13800,"SCHOOL OF NURSING, DR. GOVINDANS HOSPITAL, CONVENT ROAD, THIRUVANANTHAPURAM",Kerala,Thiruvananthapuram,2011,Urban,Nursing,Private Un-Aided
S-5243,"SCHOOL OF NURSING, DURGABAI DESHMUKH GENERAL HOSPITAL & RESEARCH CENTRE, CHENNAI",Tamil Nadu,Chennai,1994,Urban,Nursing,Private Un-Aided
S-4846,SCHOOL OF NURSING EAST KHASI HILLS,Meghalaya,East Khasi Hills,1938,Urban,Nursing,State Government
S-5245,"SCHOOL OF NURSING, EX-MINISTER K. RAJARAM NAIDU PARA MEDICAL INSTITUTITONS, MADURAI",Tamil Nadu,Madurai,2009,Rural,Nursing,Private Un-Aided
S-3763,"SCHOOL OF NURSING, GENERAL HOSPITAL, AMRELI",Gujarat,Amreli,2010,Urban,Nursing,State Government
S-25499,SCHOOL OF NURSING GENERAL HOSPITAL AUNDH PUNE,Maharashtra,Pune,-,Urban,Nursing,State Government
S-3789,"SCHOOL OF NURSING, GENERAL HOSPITAL, BHARUCH",Gujarat,Bharuch,1969,Urban,Nursing,State Government
S-3764,"SCHOOL OF NURSING, GENERAL HOSPITAL GODHRA",Gujarat,Panch Mahals,1982,Urban,Nursing,State Government
S-15281,"SCHOOL OF NURSING, GENERAL HOSPITAL, MANDVI",Gujarat,Surat,2014,Rural,Nursing,State Government
S-3766,"SCHOOL OF NURSING, GENERAL HOSPITAL, NADIAD",Gujarat,Kheda,1987,Urban,Nursing,State Government
S-26212,SCHOOL OF NURSING GENERAL HOSPITAL PARBHANI ,Maharashtra,Parbhani,2012,Urban,Nursing,State Government
S-3790,"SCHOOL OF NURSING(GNM), CIVIL HOSPITA, DAHOD",Gujarat,Dahod,2008,Rural,Nursing,State Government
S-12020,"SCHOOL OF NURSING(GNM), CIVIL HOSPITAL,  PALANPUR, BANASKANTHA",Gujarat,Banas Kantha,2006,Urban,Nursing,State Government
S-3768,"SCHOOL OF NURSING(GNM),GENERAL HOSPITAL, RAJPIPLA, NARMADA",Gujarat,Narmada,2008,Urban,Nursing,State Government
S-3767,"SCHOOL OF NURSING(GNM), G. K. GENERAL HOSPITAL, BHUJ- KUTCH",Gujarat,Kachchh,2005,Urban,Nursing,State Government
S-3777,"SCHOOL OF NURSING(GNM), M G S HOSPITAL, SURENDRANAGAR",Gujarat,Surendranagar,2005,Urban,Nursing,State Government
S-5325,"SCHOOL OF NURSING, GOVERNMENT ANNAL GANDHI MEMORIAL HOSPITAL, TIRUCHIRAPPALLI",Tamil Nadu,Tiruchirappalli,1980,Urban,Nursing,State Government
S-5316,"SCHOOL OF NURSING, GOVERNMENT HEADQUARTERS HOSPITAL, CUDDALORE",Tamil Nadu,Cuddalore,2004,Urban,Nursing,State Government
S-5251,"SCHOOL OF NURSING, GOVERNMENT HEADQUARTERS HOSPITAL, DINDIGUL",Tamil Nadu,Dindigul,2004,Urban,Nursing,State Government
S-5261,"SCHOOL OF NURSING, GOVERNMENT HEADQUARTERS HOSPITAL, KANCHEEPURAM",Tamil Nadu,Kancheepuram,1982,Urban,Nursing,State Government
S-5321,"SCHOOL OF NURSING, GOVERNMENT HEADQUARTERS HOSPITAL, NAGAPATTINAM",Tamil Nadu,Nagapattinam,2004,Urban,Nursing,State Government
S-5254,"SCHOOL OF NURSING, GOVERNMENT HEADQUARTERS HOSPITAL, RAMANATHAPURAM",Tamil Nadu,Ramanathapuram,2004,Urban,Nursing,State Government
S-5257,"SCHOOL OF NURSING, GOVERNMENT HEADQUARTERS HOSPITAL, THE NILGIRIS",Tamil Nadu,The Nilgiris,2004,Urban,Nursing,State Government
S-5326,"SCHOOL OF NURSING, GOVERNMENT HEADQUARTERS HOSPITAL, TIRUPPUR",Tamil Nadu,Tiruppur,2004,Urban,Nursing,State Government
S-5258,"SCHOOL OF NURSING, GOVERNMENT HEADQUARTERS HOSPITAL, VIRUDHUNAGAR",Tamil Nadu,Virudhunagar,2005,Rural,Nursing,State Government
S-5320,"SCHOOL OF NURSING, GOVERNMENT KILPAUK MEDICAL COLLEGE HOSPITAL, CHENNAI",Tamil Nadu,Chennai,2001,Urban,Nursing,State Government
S-5322,"SCHOOL OF NURSING, GOVERNMENT STANLEY MEDICAL COLLEGE HOSPITAL, CHENNAI",Tamil Nadu,Chennai,1920,Urban,Nursing,State Government
S-5259,"SCHOOL OF NURSING, GOVERNMENT THENI MEDICAL COLLEGE HOSPITAL, THENI",Tamil Nadu,Theni,2010,Rural,Nursing,State Government
S-5260,"SCHOOL OF NURSING, GOVERNMENT VELLORE MEDICAL COLLEGE HOSPITAL, VELLORE",Tamil Nadu,Vellore,2010,Rural,Nursing,State Government
S-4269,SCHOOL OF NURSING GULBARGA,Karnataka,Kalaburagi,1960,Urban,Nursing,Central Government
S-5166,SCHOOL OF NURSING HARISH HOSPITAL ALWAR,Rajasthan,Alwar,2006,Rural,Nursing,Private Un-Aided
S-4882,SCHOOL OF NURSING & HEALTH SCIENCES GANJAM,Odisha,Ganjam,2005,Urban,Nursing,Local Body
S-16114,School Of Nursing Holy Cross Hospital Kunkuri,Chhattisgarh,Jashpur,2009,Rural,Nursing,Private Un-Aided
S-4582,SCHOOL OF NURSING IDUKKI,Kerala,Idukki,2008,Urban,Nursing,Private Un-Aided
S-24651,SCHOOL OF NURSING INSTITUTE OF PARAMEDICAL,Uttar Pradesh,Lucknow,-,Urban,Nursing,Private Un-Aided
S-5527,SCHOOL OF NURSING IPGME&R SSKM HOSPITAL KOLKATA,West Bengal,Kolkata,1957,Urban,Nursing,State Government
S-4809,SCHOOL OF NURSING JALNA,Maharashtra,Jalna,2002,Urban,Nursing,Private Un-Aided
S-17593,"School of Nursing, Jangipur Sub Divisional Hospital",West Bengal,Murshidabad,2017,Urban,Nursing,State Government
S-12835,"School of Nursing, J L N M C H BHAGALPUR",Bihar,Bhagalpur,1970,Urban,Nursing,State Government
S-4583,SCHOOL OF NURSING KANJOOR ERNAKULAM,Kerala,Ernakulam,2004,Rural,Nursing,Private Un-Aided
S-4584,SCHOOL OF NURSING KANNIAMPURAM OTTAPALAM PALAKKAD,Kerala,Palakkad,2001,Rural,Nursing,Private Un-Aided
S-5318,"SCHOOL OF NURSING, KANYAKUMARI MEDICAL COLLEGE & HOSPITAL, KANYAKUMARI",Tamil Nadu,Kanniyakumari,2004,Urban,Nursing,State Government
S-4587,SCHOOL OF NURSING KASARAGOD,Kerala,Kasaragod,2002,Urban,Nursing,Local Body
S-12911,"SCHOOL OF NURSING, KASTURBA HOSPITAL, CHENNAI",Tamil Nadu,Chennai,2004,Urban,Nursing,State Government
S-19488,SCHOOL OF NURSING KCH,Manipur,Kangpokpi,-,Rural,Nursing,Private Un-Aided
S-18272,"School of Nursing, K.T.S.GENERAL HOSPITAL, GONDIA",Maharashtra,Gondia,2013,Urban,Nursing,State Government
S-3871,SCHOOL OF NURSING KULLU,Himachal Pradesh,Kullu,2004,Rural,Nursing,Private Un-Aided
S-4591,SCHOOL OF NURSING KUNNAMKULAMTHRISSUR,Kerala,Thrissur,2000,Rural,Nursing,Private Aided (Government Aided)
S-4592,SCHOOL OF NURSING KURIAKOSE CHAVARA MEMORIAL HOSPITAL L S P O NOORANADU ALAPPUZHA,Kerala,Alappuzha,2002,Rural,Nursing,Private Un-Aided
S-17797,"School of Nursing, Late Kedari Redekar Shikshan Sanstha",Maharashtra,Kolhapur,2006,Rural,Nursing,Private Un-Aided
S-4603,SCHOOL OF NURSING LOURDE HOSPITAL TALIPARAMBA KANNUR,Kerala,Kannur,2001,Urban,Nursing,Private Un-Aided
S-22439,"SCHOOL OF NURSING, MAKUNDA CHRISTIAN LEPROSY AND GENERAL HOSPITAL",Assam,Sribhumi,-,Rural,Nursing,Private Un-Aided
S-4581,SCHOOL OF NURSING MARADU ERNAKULAM,Kerala,Ernakulam,2003,Urban,Nursing,Private Un-Aided
S-15425,School Of Nursing Mata Kaushalya Government Hospital,Punjab,Patiala,2011,Urban,Nursing,State Government
S-12884,"SCHOOL OF NURSING, MAYOR RADHAKRISHNAN INSTITUTE OF PARAMEDICAL SCIENCES, CUDDALORE",Tamil Nadu,Cuddalore,2006,Rural,Nursing,Private Un-Aided
S-5555,"SCHOOL OF NURSING, MCH, KOLKATA",West Bengal,Kolkata,1938,Urban,Nursing,State Government
S-15287,SCHOOL OF NURSING MEMORIAL HOSPITAL,Uttar Pradesh,Farrukhabad,2015,Urban,Nursing,Private Un-Aided
S-3776,"SCHOOL OF NURSING, M G G HOSPITAL, NAVASARI",Gujarat,Navsari,1989,Urban,Nursing,State Government
S-12881,"SCHOOL OF NURSING, MOUNT TABOR MEDICAL MISSION HL, PUDUKOTTAI",Tamil Nadu,Pudukkottai,2000,Rural,Nursing,Private Un-Aided
S-4593,SCHOOL OF NURSING MUNDAKAYAM EAST IDUKKI,Kerala,Idukki,2001,Rural,Nursing,Private Un-Aided
S-4594,SCHOOL OF NURSING NEDUMKANDARM IDUKKI,Kerala,Idukki,2000,Rural,Nursing,Private Un-Aided
S-4595,SCHOOL OF NURSING NORTH PARAVUR ERNAKULAM,Kerala,Ernakulam,2000,Urban,Nursing,Private Un-Aided
S-15463,"School of Nursing, N P M Institute of Medical Science and Research , In Front of Dist. H Q Hospital, Dist-Keonjhar, Odisha-758001",Odisha,Keonjhar,2006,Rural,Nursing,Private Un-Aided
S-22452,SCHOOL OF NURSING OIL INDIA HOSPITAL DULIAJAN,Assam,Dibrugarh,-,Rural,Nursing,Private Aided (Government Aided)
S-4596,SCHOOL OF NURSING OLLUR THRISSUR,Kerala,Thrissur,2000,Urban,Nursing,Private Aided (Government Aided)
S-4585,SCHOOL OF NURSING PARIYARAM KANNUR,Kerala,Kannur,2002,Rural,Nursing,State Government
S-17040,"School of Nursing Rachana Trust, Nashik",Maharashtra,Nashik,2006,Urban,Nursing,Private Un-Aided
S-5302,"SCHOOL OF NURSING, RAJAPALAYAM NURSES TRAINING INSTITUTE, KANYAKUMARI",Tamil Nadu,Kanniyakumari,1993,Rural,Nursing,Private Un-Aided
S-4813,SCHOOL OF NURSING RATNAGIRI,Maharashtra,Ratnagiri,1959,Urban,Nursing,State Government
S-4883,SCHOOL OF NURSING RAYAGADA,Odisha,Rayagada,1978,Rural,Nursing,Private Un-Aided
S-4814,SCHOOL OF NURSING SADASHIV PETH PUNE,Maharashtra,Pune,1998,Urban,Nursing,Private Un-Aided
S-12473,"SCHOOL OF NURSING SANTHI HOSPITAL OMASSERY, CALICUT",Kerala,Kozhikode,2000,Rural,Nursing,Private Un-Aided
S-4816,SCHOOL OF NURSING SATARA,Maharashtra,Satara,2008,Rural,Nursing,Private Aided (Government Aided)
S-22471,"SCHOOL OF NURSING, SATRIBARI CHRISTIAN HOSPITAL",Assam,Kamrup Metro,-,Urban,Nursing,Private Un-Aided
S-3794,"SCHOOL OF NURSING, SHETH V. S. HOSPITAL, ELISBRIDGE, AHEMDABAD",Gujarat,Ahmedabad,1933,Urban,Nursing,Local Body
S-4601,SCHOOL OF NURSING SHORNUR ROAD THRISSUR,Kerala,Thrissur,1996,Urban,Nursing,Private Un-Aided
S-15439,"SCHOOL OF NURSING, SHRI GURUGOVINDSINGJI MEMORIAL HOSPITAL, NANDED",Maharashtra,Nanded,-,-,Nursing,State Government
S-3872,SCHOOL OF NURSING SIRMOUR,Himachal Pradesh,Sirmaur,1952,Urban,Nursing,State Government
S-3803,"SCHOOL OF NURSING, SIR PARTAP GENERAL HOSPITAL, HIMATNAGAR",Gujarat,Sabar Kantha,1989,Urban,Nursing,State Government
S-4602,SCHOOL OF NURSING SREEKANDAPURAM HOSPITAL KANDIYOOR ALAPPUZHA,Kerala,Alappuzha,2005,Rural,Nursing,Private Un-Aided
S-18176,"School of Nursing S.R.T.R. Medical College and Hospital, Ambajogai",Maharashtra,Beed,-,Rural,Nursing,State Government
S-13870,"SCHOOL OF NURSING, ST. AUGUSTINE CHRISTIAN HOSPITAL, CHIRANG",Assam,Chirang,2011,Rural,Nursing,Private Un-Aided
S-4617,"SCHOOL OF NURSING, ST JOSEPH HOSPITAL KOLLAM",Kerala,Kollam,-,Rural,Nursing,Private Un-Aided
S-3899,"SCHOOL OF NURSING ST. JOSEPH'S HOSPITAL, GUMLA",Jharkhand,Gumla,-,Rural,Nursing,Private Un-Aided
S-12322,"SCHOOL OF NURSING ST. SEBASTIANs VISITATION HOSPITAL ARTHUNKAL, CHERTHALA",Kerala,Alappuzha,2003,Rural,Nursing,Private Un-Aided
S-4586,SCHOOL OF NURSING TALIPARAMBA CO- OPERATIVE HOSPITAL TALIPARAMBA KANNUR,Kerala,Kannur,2008,Urban,Nursing,Private Aided (Government Aided)
S-5362,"SCHOOL OF NURSING, THANJAVUR MEDICAL COLLEGE HOSPITAL THANJAVUR",Tamil Nadu,Thanjavur,1961,Urban,Nursing,State Government
S-19671,SCHOOL OF NURSING THINGDAWL,Mizoram,Kolasib,2017,Rural,Nursing,State Government
S-12886,"SCHOOL OF NURSING, TIRUNELVELI MEDICAL COLLEGE HL, TIRUNELVELI",Tamil Nadu,Tirunelveli,1987,Urban,Nursing,State Government
S-13846,"SCHOOL OF NURSING, TITBABOR, JORHAT, JMCH CAMPUS",Assam,Jorhat,-,Rural,Nursing,State Government
S-12896,"SCHOOL OF NURSING, TUTICORIN MEDICAL COLLEGE HL,TUTICORIN",Tamil Nadu,Thoothukkudi,2004,Urban,Nursing,State Government
S-4605,SCHOOL OF NURSING UPHILL MALAPPURAM,Kerala,Malappuram,2000,Urban,Nursing,Private Aided (Government Aided)
S-4817,SCHOOL OF NURSING WADGAON PUNE,Maharashtra,Pune,2004,Urban,Nursing,Private Un-Aided
S-15558,"school of nursing, zashi rani chouk, General Hospital Wardha",Maharashtra,Wardha,1960,Urban,Nursing,State Government
S-15521,School of Public Health Nursing,Maharashtra,Nagpur,1928,Urban,Nursing,State Government
S-20568,SCT SCHOOL OF NURSING,Karnataka,Bengaluru Urban,2019,Rural,Nursing,Private Un-Aided
S-20492,S D COLLEGE OF NURSING,Haryana,Bhiwani,2012,Rural,Nursing,Private Un-Aided
S-4237,S D JAYARAM SCHOOL OF NURSING MANDYA,Karnataka,Mandya,2006,Urban,Nursing,Private Un-Aided
S-4238,S D M INSTITUTE OF NURSING SCIENCES DHARWAD,Karnataka,Dharwad,2006,Urban,Nursing,Private Un-Aided
S-3707,S D SAHEWALLA MEMORIAL SCHOOL OF NURSING DIBRUGARH,Assam,Dibrugarh,-,-,Nursing,Private Aided (Government Aided)
S-17811,SDVM COLLEGE OF NURSING AND RESEARCH INSTITUTE,Madhya Pradesh,Gwalior,-,Urban,Nursing,Private Un-Aided
S-4239,S E A SCHOOL OF NURSING BANGALORE,Karnataka,Bengaluru Urban,2003,Urban,Nursing,Private Aided (Government Aided)
S-20746,SEBA INSTITUTE OF NURSING,West Bengal,Birbhum,2021,Rural,Nursing,Private Aided (Government Aided)
S-12892,"SEETHALAKSHMI SCHOOL OF NURSING, ERODE",Tamil Nadu,Erode,2010,Urban,Nursing,Private Un-Aided
S-24541,"SEF S SURYADATTA COLLEGE OF NURSING,PARAMEDICAL SCIENCES AND TECHNOLOGY,BAVDHAN PUNE MULSHI",Maharashtra,Pune,-,Urban,Nursing,Private Un-Aided
S-25901,SERVITE ANM (F) TRAINING SCHOOL,Tamil Nadu,Tiruchirappalli,2000,Rural,Nursing,Private Un-Aided
S-26111,SETH BADRI PRASAD SMARITI MAHAVIDHYALAYA,Uttar Pradesh,Jalaun,2024,Rural,Nursing,Private Un-Aided
S-13968,"Set Institute of Nurisng, Junagadh",Gujarat,Junagadh,2011,Urban,Nursing,Private Aided (Government Aided)
S-18000,set paramedical institute pazalpora bhejbhera,Jammu and Kashmir,Anantnag,2015,Urban,Nursing,Private Un-Aided
S-23679,SEVA COLLEGE OF NURSING,Odisha,Sambalpur,2024,Rural,Nursing,Private Un-Aided
S-17769,SEVADHAM TRUST A.S.M.T SCHOOL OF NURSING,Maharashtra,Pune,2006,Rural,Nursing,Private Un-Aided
S-26831,SEVANAND INSTITUTE OF AYUSH NURSING,Rajasthan,Tonk,2025,Rural,Nursing,Private Un-Aided
S-22292,SEVANA  SCHOOL OF NURSING,Kerala,Palakkad,-,Rural,Nursing,Private Un-Aided
S-15443,"Seva Nursing School,Shrirampur",Maharashtra,Ahilyanagar,2006,Rural,Nursing,Private Un-Aided
S-25817,"SEVASADAN COLLEGE OF NURSING, MIRAJ ",Maharashtra,Sangli,2024,Urban,Nursing,Private Un-Aided
S-22742,SEVASADAN SCHOOL OF NURSING GADHINGLAJ,Maharashtra,Kolhapur,2023,Urban,Nursing,Private Un-Aided
S-4884,SEVA SCHOOL OF NURSING ANGUL,Odisha,Angul,2006,Rural,Nursing,Private Un-Aided
S-3612,SEVEN HILLS HOSPITAL SCHOOL OF NURSING VISAKHAPATNAM,Andhra Pradesh,Visakhapatnam,1991,Urban,Nursing,Private Un-Aided
S-3895,SEVENTH DAY ADVENTIST HOSPITAL RANCHI,Jharkhand,Ranchi,1997,Urban,Nursing,Private Un-Aided
S-15292,S.G. INSTITUTE OF NURSING,Uttar Pradesh,Bareilly,2013,Rural,Nursing,Private Aided (Government Aided)
S-27008,SGI SCHOOL OF MEDICAL SCIENCES KEONJHAR,Odisha,Keonjhar,2024,Rural,Nursing,Private Un-Aided
S-5007,S G L NURSING SCHOOL JALANDHAR,Punjab,Jalandhar,2006,Rural,Nursing,Private Un-Aided
S-23419,SG SCHOOL OF NURSING AHMEDPUR,Maharashtra,Latur,2024,Rural,Nursing,Private Un-Aided
S-4240,S G V INSTITUTE OF NURSING BELGAUM,Karnataka,Belagavi,2005,Urban,Nursing,Private Un-Aided
S-20610,SHABARI MATHA SCHOOL OF NURSING BIDAR,Karnataka,Bidar,2002,Urban,Nursing,Private Un-Aided
S-17254,SHABBIR AHMED ANSARI NURSING SCHOOL MIRAJ DIST-SANGLI,Maharashtra,Sangli,2011,Urban,Nursing,Private Un-Aided
S-3613,SHADAN SCHOOL OF NURSING HYDERABAD,Telangana,Ranga Reddy,2004,Urban,Nursing,Private Un-Aided
S-16794,SHAGUN INSTITUTE OF NURSING,Gujarat,Devbhumi Dwarka,2017,Rural,Nursing,Private Un-Aided
S-20447,SHAGUN INSTITUTE OF NURSING,Gujarat,Jamnagar,2021,Urban,Nursing,Private Un-Aided
S-3843,SHAHEED BABA DEEP SINGH SCHOOL OF NURSING FATEHABAD,Haryana,Fatehabad,2006,Rural,Nursing,Private Un-Aided
S-22362,SHAHEED BHAGAT SINGH COLLEGE OF NURSING MEHAL KALAN,Punjab,Barnala,-,Rural,Nursing,Private Un-Aided
S-15524,"Shaheed Madan La Dhingra Memorial Government School of Nursing, Amritsar",Punjab,Amritsar,2011,Urban,Nursing,State Government
S-3845,SHAHEED UDHAM SINGH SCHOOL OF NURSING FATEHABAD,Haryana,Fatehabad,1996,Rural,Nursing,Private Un-Aided
S-17903,"SHAHNAWAZ NURSING SCHOOL, AURANGABAD",Maharashtra,Chhatrapati Sambhajinagar,2011,Urban,Nursing,Private Un-Aided
S-15670,"Shaikh School of  Nursing,  Odisha",Odisha,Mayurbhanj,2010,Urban,Nursing,Private Un-Aided
S-5483,SHAIL INSTITUTE OF NURSING LUCKNOW,Uttar Pradesh,Lucknow,2009,Urban,Nursing,Private Un-Aided
S-19714,SHAIL SUBHASH INSTITUTE OF PARAMEDICAL SCIENCES,Uttar Pradesh,Ballia,2020,Rural,Nursing,Private Un-Aided
S-16516,shakeel college of nursing,Uttar Pradesh,Bara Banki,2016,Rural,Nursing,Private Un-Aided
S-22219,SHAKTI INSTITUTE OF NURSING,Gujarat,Arvalli,-,Urban,Nursing,Private Un-Aided
S-15651,"Shaktirupa School of Nursing , Odisha",Odisha,Jagatsinghapur,2006,Urban,Nursing,Private Un-Aided
S-20374,SHAKUNTALA NURSING COLLEGE,Jharkhand,Godda,2018,Rural,Nursing,State Government
S-18854,Shakuntala Nursing School Mudkhed Tq Mudkhed District Nanded,Maharashtra,Nanded,2011,Rural,Nursing,Private Un-Aided
S-16034,Shakuntla School of Nursing,Delhi,South West,2016,Rural,Nursing,Private Un-Aided
S-25336,"SHALINITAI MEGHE COLLEGE OF NURSING, HINGANA ROAD, WANADONGARI, NAGPUR",Maharashtra,Nagpur,-,Rural,Nursing,Private Un-Aided
S-19005,Shalinitai Meghe college of nursing salod hirapur wardha,Maharashtra,Wardha,2019,Rural,Nursing,Private Un-Aided
S-17997,shalom nursing school,Maharashtra,Wardha,2008,Rural,Nursing,Private Un-Aided
S-24556,SHALOM SCHOOL OF NURSING GNM BULDHANA,Maharashtra,Buldhana,-,Urban,Nursing,Private Un-Aided
S-21414,"SHAMBHUNATH RESEARCH INSTITUTE OF MEDICAL SCIENCES AND HOSPITAL, JHALWA, PRAYAGRAJ",Uttar Pradesh,Prayagraj,-,Urban,Nursing,Private Un-Aided
S-15293,SHAMM E HUSAINI INSTITUTE OF NURSING COLLEGE AND HOSPITAL,Uttar Pradesh,Ghazipur,2008,Rural,Nursing,Private Un-Aided
S-22432,SHANJIVANI INSTITUTE OF NURSING LUNAWADA,Gujarat,Mahisagar,-,Urban,Nursing,Private Un-Aided
S-15268,Shankar Nursing and Paramedical Institute,Uttar Pradesh,Gorakhpur,2012,Rural,Nursing,Private Un-Aided
S-16930,Shankersinh Vaghela Bapu ANM School of Nursing,Gujarat,Gandhinagar,2017,Rural,Nursing,Private Un-Aided
S-20432,SHANTAI NURSING VIDYALAY PALGHAR,Maharashtra,Palghar,2021,Urban,Nursing,Private Un-Aided
S-18937,SHANTI ANM TRAINING SCHOOL OF NURSING BALICHANDRAPUR,Odisha,Jajpur,2019,Rural,Nursing,Private Un-Aided
S-4272,SHANTI DHAMA SCHOOL OF NURSING BANGALORE URBAN,Karnataka,Bengaluru Urban,2003,Urban,Nursing,Private Un-Aided
S-26237,SHANTI MEMORIAL SCHOOL OF NURSING,Odisha,Jagatsinghapur,2025,Urban,Nursing,Private Un-Aided
S-23013,SHANTI NIKETAN COLLEGE OF NURSING AND PARAMEDICAL SCIENCES,Uttar Pradesh,Meerut,2023,Rural,Nursing,Private Un-Aided
S-23598,"SHANTINIKETAN COLLEGE OF NURSING, JALNA",Maharashtra,Jalna,2024,Urban,Nursing,Private Un-Aided
